id,username,likes,views,comments,shares,collects,repost,isCommerce,description,duration,created_at,VideoQuality,hashtags,date,sentiment,comment_count,accumulated_text
7379709322881748270,Haein | Korean Fashion,938,21600,8,13,156,0,False,Part 4 | still embracing bloquette🎀 which look is your fav? . . outfit links will be posted in my bio + story!! this one was a little harder but did my best ☺️ 🇰🇷 oversized tee + baggy jeans is so korea coded!! I think I first learned about street style from korean fashion sites lol 😌 - brands worn: @blackup_kr (wide leg jeans) @axelarigato (chunky sneakers)  🇯🇵 this one is hit or miss…I went for a cosplay(?)-esque look that focused on cute hairstyle + femininity through the tights & heels🙊 - brands worn: @helmutlang (black mini skirt) @poshmark (mary janes)  🇨🇳 went for a simple ish look that focused on co-ord matching set with the pink skirt!! I think the mini skirt + chunky sneaker combo also is a tell 💕 - brands worn: @gillyhicks (athletic skort) @axelarigato (dad sneakers) . . . #koreanstyle #chinesestyle #japanesestyle #bloquette #blokecore #asianstyle #asianfashion  SEO bloke core aesthetic | bloquette outfits | asian style inspo | how to dress korean | how to dress chinese | how to dress japanese | style inspo for summer | jersey outfits | how to style a jersey ,7,1718222478,normal,"['koreanstyle', 'chinesestyle', 'japanesestyle', 'bloquette', 'blokecore', 'asianstyle', 'asianfashion']",2024-06-12,4.2,5,"THE FIRST ONE IS ADORABLE where did you get the pants for the korea one! their so cute No cuz these are so cute watching this in a jersey with the same type of jeans🙂 collaboration! send ""Sono"" to our instagram IG SAGAJEWELS.STORE 🍫💜"
7379950700379360513,nz ★,187,2304,4,12,24,0,False,blokette core always 🌟 #tiktokfashion #outfitideas #blokettecore #casualoutfits ,6,1718278678,normal,"['tiktokfashion', 'outfitideas', 'blokettecore', 'casualoutfits']",2024-06-13,4.0,1,cutie
7379989867603758354,KROM,250,9003,6,15,32,0,False,"📍Ain Remeneh, Beirut WhatsApp 71-005937 #lebanon #beirut #jerseys #vintage #footballjerseys #footballshirts #menfashion #viral #fypp #retro #blokecore #streetwear #retrojerseys ",29,1718287794,lower,"['lebanon', 'beirut', 'jerseys', 'vintage', 'footballjerseys', 'footballshirts', 'menfashion', 'viral', 'fypp', 'retro', 'blokecore', 'streetwear', 'retrojerseys']",2024-06-13,4.333333333333333,6,you have neymar barcelona 2014/15 I will visit Beirut soon I am from Germany what are the prices? Store name I want them all🔥🔥 Wow🔥 🔥🔥🔥
7380254616065215750,JUALAN OUTFIT,8193,167200,7,118,706,0,False,#CapCut #blokecore #blokecoreoutfit #streetwear #rekomendasioutfit ,16,1718349437,normal,"['capcut', 'blokecore', 'blokecoreoutfit', 'streetwear', 'rekomendasioutfit']",2024-06-14,3.5714285714285716,7,cek keranjang kuning buat ubah penampilan lo🔥 ada jagoan gua wkwkwkkww @svmmerloco2 😬😬 💯 @Ssan•~• svmmerloco 🔥 🤩
7380317629342403841,yu,503,37100,6,9,80,0,False,football jerseys season⚽️🇮🇹 #fyp #fypシ #fyppppppppppppppppppppppp #おすすめ #lfl❤️ ,6,1718364111,normal,"['fyp', 'fypシ', 'fyppppppppppppppppppppppp', 'おすすめ', 'lfl❤️']",2024-06-14,3.3333333333333335,6,ナポリユニきたらバチイケ 背番号とか入れるのはタブーですか？ 1つ目のパンツどこのですか？ こ今季のミランは買うよな 出品してたグレーのワークチノパンツどこのですか？ ヴェネツィアあっつ〜
7380324658765172001,zeph.oner,433,26100,23,28,42,0,False,daily outfit pt. 32: PINK JERSEYY #ootd #grwm #style #jersey #fyp #fy #foryoupage ,11,1718365747,normal,"['ootd', 'grwm', 'style', 'jersey', 'fyp', 'fy', 'foryoupage']",2024-06-14,3.3636363636363638,11,Edgar hat neues Outfit whoher die erste pants song? Hose woher? Du hast die kunais vergessen oder ein katana Here before bro become popular🖐️ Epic🔥 what brand is the jersey? 😂😂😂 😂😂😂 Song: facts (charlie heat version) by Ye
7380344492810964242,kyatchaclothes,55,1441,4,3,4,0,False,"finally remembered my tiktok password :’) we’ll be at @The Hammock Market tmr (15/6), see you guys there🤎 . . . #tiktoksg #fyp #sgsmallbusiness #sgthrift #blokecore #pinterest #foryoupage ",14,1718370364,normal,"['tiktoksg', 'fyp', 'sgsmallbusiness', 'sgthrift', 'blokecore', 'pinterest', 'foryoupage']",2024-06-14,5.0,1,YOU LOOK SO GOOD IN EVERYTHING 🥰🥰
7380526141104262405,Keceoutfit.id,21700,415600,19,530,3898,0,False,shortpants style  . . . . #keceoutfit #casualoutfit #casual #ootdinspiration #ootdinspo #outfitinspo #outfitinspiration #kece #style #homiesstyle #jerseyoutfit #shortpants #CapCut ,25,1718412669,normal,"['keceoutfit', 'casualoutfit', 'casual', 'ootdinspiration', 'ootdinspo', 'outfitinspo', 'outfitinspiration', 'kece', 'style', 'homiesstyle', 'jerseyoutfit', 'shortpants', 'capcut']",2024-06-15,4.111111111111111,18,🔥outfit hitamku 🖤 The amity affliction🙌🏻🙌🏻 nama dj nya apa ya kak ? lebih suka yg shortpant dari pada losepants g ribet shortpants baju kaos udah no debat sih 😜 keceh parah😋 👍👍 👍 😎 🙏 😂😂😂 😂😂😂 @Fa.Ysf 💗✨ 🤩🤩🤩 TAA ngga tuh kakiku dekil ngene sek lah tergantung muka ygy
7380619777879887109,Dano4kaaa,36,990,0,0,0,0,False,💅⚽️#outfit  #football #soccer #soccertiktok #footballtiktok #blokecore #r9 #ronaldo #ronaldonazario #ronaldonazario🇧🇷 #milan #milano #intermilan #championsleague #italy #worldcup #brazil #footballgirl #blokecorestyle #blokecoreoutfit #soccergirl #outfitideas #outfitinspiration #outfitoftheday #casualoutfits #streetwear ,16,1718434458,normal,"['outfit', 'football', 'Soccer', 'soccertiktok', 'footballtiktok', 'blokecore', 'r9', 'ronaldo', 'ronaldonazario', 'ronaldonazario🇧🇷', 'milan', 'milano', 'intermilan', 'championsleague', 'italy', 'worldcup', 'brazil', 'footballgirl', 'blokecorestyle', 'blokecoreoutfit', 'soccergirl', 'outfitideas', 'outfitinspiration', 'outfitoftheday', 'casualoutfits', 'streetwear']",2024-06-15,,0,
7380684635719650567,KROM,118,4788,4,14,14,0,False,Limited quantities! Grab yours now. #lebanon #beirut #jerseys #vintage #footballjerseys #footballshirts #menfashion #viral #fypp #retro #blokecore #streetwear #retrojerseys #footballjersey #fyp #outfitideas #summeroutfit ,21,1718449559,lower,"['lebanon', 'beirut', 'jerseys', 'vintage', 'footballjerseys', 'footballshirts', 'menfashion', 'viral', 'fypp', 'retro', 'blokecore', 'streetwear', 'retrojerseys', 'footballjersey', 'fyp', 'outfitideas', 'summeroutfit']",2024-06-15,5.0,3,how do i buy this i cant find on website Wow🔥 😳🔥
7380751562894740768,ffected,15800,193300,132,1897,4211,0,False,pink is essential for a good summer outfit 🤝🏼💅🏼 #footballjersey #blokecore #summershirt #summeroutfitideas ,12,1718465144,normal,"['footballjersey', 'blokecore', 'summershirt', 'summeroutfitideas']",2024-06-15,3.85,20,PINK IS META New clothing brand here.” whats the fabric gang Purée Worldwide shipping? hey reliable manufacturer here Il as du flow lui 🔥 where to order and is it possible to ship in philippines? How dare you rock that so good??!🤕 Hardd Where can I get this Olive CW underrated Ffected auf die 1 These are so beautiful wow HIT Clothing Manufacturer Here💯 Fresh🔥 This is dope 😎 Manufacturer here Let’s collab🔥
7380971554957446406,alfinhuda__,101,4989,0,0,9,0,False,Blokecore?  #outfitideas #blokecore #erspo,15,1718516361,normal,"['outfitideas', 'blokecore', 'erspo']",2024-06-16,,0,
7381018443786587424,zeph.oner,221,7885,8,9,28,0,False,daily outfit pt. 33: BROWN?! #ootd #grwm #style #jersey #fyp #fy #foryoupage ,12,1718527283,normal,"['ootd', 'grwm', 'style', 'jersey', 'fyp', 'fy', 'foryoupage']",2024-06-16,4.0,6,woher das shirt Ich brauch das Outfit 🖤😭 Wo her die Hose 🔥 Shirt ist krank Badass🤩
7381069495156100359,L.L,377300,3800000,1999,29300,53700,0,False,6$ 6$ 🌷✨🎀 Instock📌 Fb• JI Won,10,1718539166,lower,[],2024-06-16,3.5,20,"Ameee😻 OCUPÓ 🌷✨ díganme donde lo compro 발레코어 진심 너무 이쁨 ojala sean asi los nuevos uniformes de mi equipoo😻👍 necesito uno así con el fruncido en la cintura como hacen con los otros equipos 😭💗 SI LOS UNIFORMES SON ASÍ, SI ME ATREVO A SER DEPORTISTA. mhl bgt plis mau 200 rb jersey apaan 200 rb😔😔 sana meron din dito sa pinas😔 ada di toko apa aja ka? а где можно такое купить? I found itttt ມີຂາຍຍ💝 купите мне ее😭😭 where to buy? How to order size? ဟက်ကြိုက်တယ်🗿 Where can I buy this? yellow basket"
7381289267747753221,RenzFIT,250,9455,3,14,62,0,False,Bloke Core Ideas 📌🔥 Alternative J's📌 #fyp #outfitideas #outfitforwomen #outfitformen #menoutfitideas #foryoupage #fashionpants #shoestyle #baggypants #y2krings #outfitinspo #budolfinds #trending #affordable #recommendations #drip #fit #highquality #y2k #jersey #blokecore #blokecoreoutfit ,20,1718590335,normal,"['fyp', 'outfitideas', 'outfitforwomen', 'outfitformen', 'menoutfitideas', 'foryoupage', 'fashionpants', 'shoestyle', 'baggypants', 'y2krings', 'outfitinspo', 'budolfinds', 'trending', 'affordable', 'recommendations', 'drip', 'fit', 'highquality', 'y2k', 'jersey', 'blokecore', 'blokecoreoutfit']",2024-06-17,,0,
7381378502995545350,Rent Inspo,665,13100,0,47,73,0,False,couple fits blokecore #styleinspo #streetstyle #outfitinspo #inspo #blokecore #couplefit ,15,1718611111,normal,"['styleinspo', 'streetstyle', 'outfitinspo', 'inspo', 'blokecore', 'couplefit']",2024-06-17,5.0,1,😂😂😂
7381399412376882440,Upfront24.Shopping,5829,64500,7,203,718,0,False,NFL jersey 13$ - Ny hat 6$ - Jorts 14$  Our Insta: Upfront24.Shopping  #nfl #jersey #jorts #cambodia #trending #fashion ,11,1718615980,lower,"['nfl', 'jersey', 'jorts', 'cambodia', 'trending', 'fashion']",2024-06-17,2.2,5,song name pls Accept cash??😭😭 อยากได้🔥 13y can wear jort ng ort b? name the ti_shirt?
7381428052745604369,Natthanon Aom,200,6598,11,7,11,0,False,Goalkeeper jersey outfit🧤 #blokecore #ootd #fyp ,15,1718622652,normal,"['blokecore', 'OOTD', 'fyp']",2024-06-17,4.333333333333333,6,เท่ไปครับ โครตโหด🔥 เอาจัดดด เท่จัดพวก พิกัดกางเกงทีครับ ⚽️🔥
7381440411987971345,Natthanon Aom,179,5778,1,4,10,0,False,⚽️✨ #blokecore #ootd #outfit ,16,1718625530,normal,"['blokecore', 'OOTD', 'outfit']",2024-06-17,5.0,1,💚🩵
7381492051374001440,Classic Football Shirts,4843,153600,28,54,178,0,False,All hits no misses with our staff fits this week 😮‍💨 #euros #eurosummer #2024 #summer #blokecore #soccer #footballshirts,32,1718637557,normal,"['euros', 'eurosummer', '2024', 'Summer', 'blokecore', 'Soccer', 'footballshirts']",2024-06-17,3.5789473684210527,19,Please reply I bought a Charlton’s shirt from you ‘Go outside and come back in with this on’. where is the store Ops on 2008 Barca away shirt I bought that shirt of u and it’s fire is this site jegit because I'm afraid that the things I ordered won't arrive? Dutch shirt 🔥 £350 for an classic England shirt. Guys come on.. it’s tough out here! £350?? what a place to work 👍 I love jess I have got tampa bay mutiny1998 original for sale if anyone interested Im glad you made this a series 🙏 😏😏😏 🥰 🥰🥰🥰 🥰🥰🥰 😂😂😂 Check that first lads hard drive Don’t be a Tom 🤣 Had that GK 98 shirt but it’s lost now that kid might have nicked it
7381524725693992209,Dorrit Li,2421,33600,24,114,457,0,False,🤍who do you support for Euro? ⚽️#fyp #ootd #jerseyoutfit #football #footballjersey #mbappe #euro #fashion #outfitideas #euro2024 ,21,1718645163,normal,"['fyp', 'ootd', 'jerseyoutfit', 'football', 'footballjersey', 'mbappe', 'euro', 'fashion', 'outfitideas', 'euro2024']",2024-06-17,4.142857142857143,14,Omggg they alll slayy💃😫 Love your outfits omg 💕💕 Carried 😍😍 Loveee this 😍⚽️ Uhhh! So cute!!! This is so good 🇨🇵 france 👌 😍😍 beautiful United Kingdom ayy Jsuis amoureuse elle slay de fou😍😍🫠 @Mahmoud@habib fire @Kute Lili🌻💚 YESSS where do you buy from 😋
7381691702119075078,i want it i get it,2096,89000,4,176,817,0,False,#jersey #outfitideas #blokecore #fashion #pinterest #streetwear #trend #styling #oversize #tshirt #fypシ゚viral #foryou #4u ,12,1718684034,normal,"['jersey', 'outfitideas', 'blokecore', 'fashion', 'pinterest', 'streetwear', 'trend', 'styling', 'oversize', 'tshirt', 'fypシ゚viral', 'foryou', '4u']",2024-06-18,5.0,5,"3, 7 and 13 are the best imo WHERE CAN I GET THESE😍🙏 😔😔😔 💜 😂😂😂"
7381837444171205921,𝚄𝚗𝚒𝚏𝚘𝚛𝚖 𝙳𝚒𝚜𝚙𝚕𝚊𝚢,1113,20100,4,30,160,0,False,Styling summer essential: football jerseys 👔⭐️ • • #Uniformdisplay #styleinspo #summerstyle #summeroutfits #summertrends #blokecore #jerseyoutfit #jerseystyle ,9,1718717969,normal,"['uniformdisplay', 'styleinspo', 'summerstyle', 'summeroutfits', 'summertrends', 'blokecore', 'jerseyoutfit', 'jerseystyle']",2024-06-18,2.0,2,cant go wrong with a jersey fit @Azizi AR belanjaa satuu
7381838459561905414,Yogiprma,594,32200,25,5,57,0,False,Sepatu dari @menfootgear #menoutfitideas #inspooutfit #jersey #jerseynfl #jerseyoutfit ,45,1718718203,normal,"['menoutfitideas', 'inspooutfit', 'jersey', 'jerseynfl', 'jerseyoutfit']",2024-06-18,2.6,20,bang itu baju lu ko di gunting jersey nya dari mana tu? jersey nya beli dmna bang semangat bangg🙌 rekomendasi celana bgy bang sepatunya bagusan Timberland bg knp di gunting bang😭 TB + itu ukuran yg lu pakr brp bang inpo jerseynya 10 bnh bg bikinin outfit simpel dongg celana pertama Ama celana ke 2 bang celana bli dimna bngg English semangat ngonten nya bg😁 pertama bang assalamu'alaikum warahmatullahi wabarokatu bang😅 tumben sepi bg🗿 @Tik Toker brantakan bg
7381901791832689953,ffected,3969,122900,47,263,918,0,False,Layering our jerseys with long sleeves is underrated tho #summershirt #streetwearbrand #clothingbrand #blokecore #footballjersey ,18,1718732950,normal,"['summershirt', 'streetwearbrand', 'clothingbrand', 'blokecore', 'footballjersey']",2024-06-18,3.606060606060606,33,"What color of a long sleeve should i wear under a green shirt Hardd where do u get ur long sleeves from What pants? Von wo sind die Longsleeves? mein Jersey ist heute angekommen fit und quali 10/10 😮‍💨 Where’s the white one from ??? do you ship over malaysia ? how tall are you and what size did you get for the green one? i wanna buy one but not sure about the sizing 🙏 Broo die kosten 100 €💀 prices ar crazyy ONLINE NOW I live in Nigeria, is there any way I can order Über hoodies kommt genau so krass, vertraut 😮‍💨🔥 Welche Schuhe bei 2te fit Can I get some pls I want Klau ich That works anyday🤩 Clean 🧼 Restock the black one 🔥 Welche Hose? Olive CW so underrated how much for the shirt When do you drop again? 🔝 😂😂😂 🔥 🔥🔥🔥 The off-white checkered is sexy @ffected.co PLease spare some moments for the discussion to have business. I am eager to explore a high-quality merchandise for your brand ❤ Macher 🤝 🙂‍↔️🙂‍↔️🙂‍↔️🙂‍↔️🙂‍↔️"
7381913720009542945,DTS store | fotbalové dresy,2651,19900,32,81,144,0,False,Máš to stejně?😂    #fy #fyp #foryou #football #footballtshirt #blokecore #soccer #fotbal,6,1718735727,normal,"['fy', 'fyp', 'foryou', 'football', 'footballtshirt', 'blokecore', 'Soccer', 'fotbal']",2024-06-18,3.4,25,"vzal jsem si dres bellinghama na rozlučku a najednou jsem ztratil svoje jméno a byl jsem bellingham😂😋 já jsem Luka Modrić👑👑👑 @BG|Jozikk🤩 zejo bellingham já si rád na tréning beru Bayern, pak ní říkají tomas Muler 😂😂😂 Fr měla jsem na dresu yamala a všichni mi rikala famale jsem Torres 😘 já jsem lewangoalski Griezmann💀😭😭 Většinou nosím dres Müllera😂 My máme tréninkový trička 🤣 a ja dostal pokutu za netymove veci 🤙 jo ale nesmí to být messi ronaldo nebo naymar. jednomu borcovi říkáme vardy protze nosí jeho dres furt Ja sem haaland Kroos Ney Ney Debroise Top hráč 🥰 karabec od minuliho zari sem haaland💪 Messi 🤣 ""hey Roso""💪 já jsem hakimi jj přesně mě říkaj Vodháněl 🤣"
7381932821088161032,KROM,558,35800,18,96,104,0,False,"Replying to @monkey_man20🏟⚽️🇫🇮  Grab yours now via our website kromofficial.com WhatsApp 71-005937 📍Ain Remeneh, Beirut #lebanon #beirut #jerseys #vintage #footballjerseys #footballshirts #menfashion #viral #fypp #retro #blokecore #streetwear #outfitideas #summeroutfit #ootd #CapCut #fashion ",20,1718740177,lower,"['lebanon', 'beirut', 'jerseys', 'vintage', 'footballjerseys', 'footballshirts', 'menfashion', 'viral', 'fypp', 'retro', 'blokecore', 'streetwear', 'outfitideas', 'summeroutfit', 'OOTD', 'capcut', 'fashion']",2024-06-18,3.923076923076923,13,I can’t find your shop and how are the prices فين المحل prezzo كيف فيني اطلبو اعيش في المانيا ممكن اطلب التيشرت 3endak lamine yamal Spanish? New kit of italya How much for that? 21/22 away mbappe 🥰🥰🥰 ❤️❤️ 🔥🔥🔥 🥰🔥🔥🔥
7382106531229125893,Amba.id,2037,369500,50,210,624,0,False,Order di keranjang kuning 🙌,46,1718780619,normal,[],2024-06-19,2.45,20,"celananya bg 🙏🏻 Mw pesan min tapi warna hijau putih,polosan bisa min? Tulisan amba bisa request gak ???? bb 135 pakai size brp bang ? bb 115 ukuran apa min..? Bb 120 pake size apa 85-181 anak gym enaknya apa ye brok untuk BB 130 pake size apa bisa custom tulisan yg amba tu Gk bg? ld 145 ada? ini dia yg di tunggu² mu away musim lalu ini mah design nya ada yg blank tanpa tulisan amba ga? merasa terpanggil wak Bb 87 tb 176 pake ukuran apa kak! amba dari jomokerto kahh? celana cino panjang kapan restock? buat BB 115 ada bang? wah wah apa lgi nih"
7382151952689368325,Rama,2491,89800,41,52,697,0,False,nyoba bikin blokecore outfitt #blokecore #outfitideas #fashioninspo #outfitinspo ,14,1718791195,normal,"['blokecore', 'outfitideas', 'fashioninspo', 'outfitinspo']",2024-06-19,2.526315789473684,19,baju ny beli dimana bang? celana yg u pake sz brp tb 168 bb 59 rekomen size apa Spill sepatu bg tb 167 bb 48 kg pake size apa bg? tb 172 bb 68 pake size apa? Tb 170 Bb 55 size apa bg? tb 169 bb 55 pake ukuran apa bang 169/64 size berapa bang?? Spil baju bang bang tb 177 bb 72 ambil size apa tb 165 bb 58 size apa bg? Kak open leg size 29 brpa sepatu? spil baju bang Baju kek gitu namanya apa y nih daerah pinggang nya aman ga? gedein badan bang saran gua @Ukuuuy14
7382181781362969857,Sipecundang🦦,1699,48400,0,58,211,0,False,🥷🏾⚽️ #blokecoreoutfit #jerseyclub #vintage #intermilan #wetshamunited #mancity #juventus @˚˖𓍢ִ໋🦢˚𓍯𓂃 @Devi Dev♐️  @jessepinkman_ ,23,1718798142,normal,"['blokecoreoutfit', 'jerseyclub', 'vintage', 'intermilan', 'wetshamunited', 'mancity', 'juventus']",2024-06-19,,0,
7382460026524372230,astriipow,13800,559100,104,1132,2744,0,False,Outfit cek kali ini bersama jersey gemes😋🫵🏻 #jersey #outfitcek #ootd #fouryou ,15,1718862925,normal,"['jersey', 'outfitcek', 'ootd', 'fouryou']",2024-06-20,2.7,20,"85 🙏🙏🙏 ukuran Jersey nyaa apa kak? warna yg sm kyk kk gada😩 kaa keranjang kuning nya gaadaa keranjang kuningnya gx da kakk😭 ya putih gak ada ya sis Cek harga🙏 masih ada Brpa in ka spill baju nyaa tolonggggg coba pake keranjang kuning kak spill tasnyaaaaa ka mo nanya, tb 180 biar keliatan oversize make L atau XL? kk klo BB 55 TB 155 ukuran apa nya link Jersey nya manaa iniii kk bb tb berapa ih mauu kaa XL GADA NYAAA??? ini size xxl kak? size apa yg di pake min"
7382508576566283525,Adit,1624,41000,18,59,259,0,False,BlokeCore outfit ⚽️| kalian mau yang mana???👀 #outfit #blokecore #outfitideas #footballtiktok #outfitoftheday ,19,1718874229,normal,"['outfit', 'blokecore', 'outfitideas', 'footballtiktok', 'outfitoftheday']",2024-06-20,2.1666666666666665,12,argen🥇🏆 belii di mana bangg yg asics bang celana nya beli dimana? bloke core make sendal cocoknya sendal apa bg dapet dr mana bg? yg asics beli di mana woiiii jaketnya dijual g bang lazio ganteng sumpah yang Umbro keren bang ingpokan nama celana bang spill celana bg sepatunya apa bg @wyadittya
7382554367959797010,KAIN Jersey,95,9012,5,11,20,0,False,The King is back 🥰🥰🥰 #argentina #messi #leomessi #goat #copaamerica #copaamerica2024 #jersey #football #blokecore #viral #xuhuong #theking #king #kingleo ,26,1718884888,normal,"['argentina', 'messi', 'leomessi', 'goat', 'copaamerica', 'copaamerica2024', 'jersey', 'football', 'blokecore', 'viral', 'xuhuong', 'theking', 'king', 'kingleo']",2024-06-20,3.75,4,Báo zá em với Áp đẹp 7h sáng mai (21/6) ngen các 🐐 con 💪💪💪 ccc
7382623517734440234,Jay Goyco,50900,1500000,1826,2581,6389,0,False,How to crop your football jersey perfectly #crop #cropped #howtocrop #sewing #singer #sewingmachine #streetwear #fashion #footballjersey #jersey #fyp #trending #zyxbca #viral #foryoupage ,51,1718900993,normal,"['crop', 'cropped', 'howtocrop', 'sewing', 'singer', 'sewingmachine', 'streetwear', 'fashion', 'footballjersey', 'jersey', 'fyp', 'trending', 'zyxbca', 'viral', 'foryoupage']",2024-06-20,3.6,20,"Sus No 😭 QUEEEEN Titi dice que tengo muchos novios You go girl!! Like a cheerleader 🔥 This hurts to watch jerseys be cut 😭 forgot the matching purse Like the cheerleaders from The Longest Yard get it queen💅💅 “And 5, 6, 7, 8!” Ahhhh jersey Crop jersey reminds me of ray off scary movie😂😂 work it girl They act like Crops tops weren’t a huge style trend in the 80s/90s I love it Men who know fashion know wassup 🔥 lol wow…. 💅 I am NOT cutting my jerseys😭 Slay girlie “Yaaaasss queen” ah video What’s going on here?? He sassy maybe if it was old lol but i’m not chopping a new one up like this 😭"
7382633730935934241,viriatocamacho,10800,296000,60,896,1648,0,False,👕🔵🔵 Japan World Cup 1998 ⚽️! #japan #blockcore #blockcoreoutfit #asics #worldcup #jerseycollection #jerseys #football #soccer #outfit #outfitidea #fyp,27,1718903374,normal,"['japan', 'blockcore', 'blockcoreoutfit', 'asics', 'worldcup', 'jerseycollection', 'jerseys', 'football', 'soccer', 'outfit', 'outfitidea', 'fyp']",2024-06-20,3.2564102564102564,39,"Que talla es bro De onde es la estanteria des discos de vinil? donde puedo comprar la camisa? como puedo conbinar una del barcelona 1899-1999?? Bellerin que haces ahí hello, me gustaría poder preguntarte algo, gracias ahora me tengo que pelear por esas playeras de futbol con alguien que no lo gusta el futbol Adonde fue la boda? Instagram account name? Mua hàng như thế nào ạ burning blue🥰 Stylo brader Bem demais 🔥🔥 try with baggy what is the name of the pants? dad has something like that too😩🔥 keceh🔥 Keranjang kuningnya mana bg Fire you're not try, review jersey from DDR buddies? Germany home kit please!! unreal shirt 🔥 kece bang 🔥🔥 🥰 😁😁😁 🥰🥰🥰 🔥 @Mir. vintage jersey @Duckki 👍 😁 😂😂😂 🤝 do you wear a size up? Magliette di calcio di qualsiasi squadra, qualsiasi anno a 30€ dm parece un jefe de la mafia china volvió Pedro el escamoso 😂😂😂😂 what type of trousers do you wear?"
7382679387793116448,DTS store | fotbalové dresy,118,2668,0,7,10,0,False,"JÁGRA, WHAT ?!? čti dal… Čauu, taky se nemůžeš odtrhnout od telky🤣😮‍💨 ? My taky ne ! Kdo je tvůj favorit na EURO 2024 ? Napiš do komentářů 😎🤯#eurocz #euro24 #footballgame #blokecore #czechrepublic ",14,1718914000,normal,"['eurocz', 'euro24', 'footballgame', 'blokecore', 'czechrepublic']",2024-06-20,,0,
7383068199937379589,Outvitamin,93700,1100000,644,3088,9019,0,False,jagoan aing 🔥🥵🥵 #derpanzer🇩🇪 #dfbteam #jerman #adidas #blokecore  #ootd #streetwear ,19,1719004524,normal,"['derpanzer🇩🇪', 'dfbteam', 'jerman', 'adidas', 'blokecore', 'OOTD', 'streetwear']",2024-06-21,3.3,20,"Info jersey jerman Dónde puedo conseguir esas prendas ? retrooo abiizzz ᴋᴀʟᴏ ᴀᴊᴀ ʙᴀᴊᴜ ᴘᴏʀᴛᴜɢᴀʟ ᴋᴀʏᴀ ɢɪᴛᴜ Jerman dimanja Adidas cuy😁 info jersey jerman cooo, gw co sekarang🔥 Soal vintage jersey Jerman juaranya 😭 ngiler bgt!! Beli dimana sih jerseynya😭 adidas itu brand yg berasal dari jerman jadi jersey nya spesial semua anjirr Jersey nya german kok kece kece ya jarang ada yang gagal gitulah Vintage parah 🔥 bajunya bagus bgt😭 Salam satu pendukung no 01 Germany ☝🏼 pecinta jerman jaman klose😎😎 yg dipake toni 🔥.. pengen beli tpi ada pelanginya ya 😩😭 jaket yg di pake musiala beli dimana ya itu tracktop jerman beli dimana dah. pengen ci😭 werner gak main kah? itu sponsor Jerman VW ? jersey jerman kece2 bgt"
7383136533731118354,Daniel Cox,220,7961,7,35,21,0,False,Football jersey outfit #outfit #footballjersey #vintagejersey #outfitideas #ootd #fashiontiktok #jersey #blokecore #adidas  ,9,1719020440,normal,"['outfit', 'footballjersey', 'vintagejersey', 'outfitideas', 'ootd', 'fashiontiktok', 'jersey', 'blokecore', 'adidas']",2024-06-22,2.75,4,Oh fifa song So cuteee 🥰 Jersey is too sick 🔥🔥 Where did you get the jersey🔥🔥?
