id,username,likes,views,comments,shares,collects,repost,isCommerce,description,duration,created_at,VideoQuality,hashtags,date,sentiment,comment_count,accumulated_text
7292485810362813742,Shop Tucky,2403,307100,42,231,629,0,False,"It’s that time of year again!  We had a couple friends here suggest with style a jersey wirh a Tucky. And they couldn’t have been a better match! If you have any games in your future, you’ll definitely want to order a Tucky.  The Tucky is super comfortable!  You’ll spend more time cheering for your team and less time worrying about what you’re wearing. Plus you won’t have to re-tuck during a bathroom break, which means you’ll miss less of the action on the field! #ho#howtostyleajerseyo#howtowearafootballjerseyh#whattoweartoafootballgameo#footballstyleo#howtostyleajerseyu#tucky",13,1697914180,normal,"['howtostyleajersey', 'howtowearafootballjersey', 'whattoweartoafootballgame', 'footballstyle', 'tucky']",2023-10-21,3.3,10,i just wanna know what jeans these are 😭 I usually just buy kids size jersey so it fits better or women’s size and it’s more him fitting The time of the oversized *hockey* jersey for me When will the xs/s in blush be restocked? My baby daughter got excited when she heard this ad because she thought you were saying ducky 😂🥹 i need!!! 😊😂😃☺️ @Grace Or just tuck into your bra Not a panthers jersey💀
7292666434314882309,Baron73,859,18300,56,20,51,0,False,#blokecore #jersey #ootd ,17,1697956222,normal,"['blokecore', 'jersey', 'OOTD']",2023-10-22,,0,
7292767063548890373,demoan,4291,529600,7,85,694,0,False,⚽️ #blockcore #blockcorestyle #jersey ,15,1697979651,normal,"['blockcore', 'blockcorestyle', 'jersey']",2023-10-22,3.6,5,😁 😁 🥰 itu yg di pake size yg besar atau kecil kak? не идёт
7292779770679479557,blokecore,1030,55200,96,13,150,0,False,Koleksiyonunuzu tamamlamak ve renk katmak için hepinizi bekleriz🩵🎽 #kesfet #forma #beniöneçıkart ,13,1697982610,normal,"['kesfet', 'forma', 'beniöneçıkart']",2023-10-22,2.0,2,sunderland forması? Wolfsburg varmı
7293541938408607008,nya 🗡️,1265,10500,2,1,90,0,False,le 2e outfit 🤭 #outfitinspo #y2k #blokecore #acubifashion #coquette #harajuku #fyp ,5,1698160069,normal,"['outfitinspo', 'y2k', 'blokecore', 'acubifashion', 'coquette', 'harajuku', 'fyp']",2023-10-24,,0,
7293581110951382304,Nicolò Pirlo,17000,244700,68,195,369,0,False,Che squadra tifa Damiano dei Maneskin? #blokecore ,27,1698169190,normal,['blokecore'],2023-10-24,,0,
7293648830514498862,lucy_edwards7,294,34300,5,7,111,0,False,How i style a jersey #jerseyoutfit #jerseyoutfitideas #everdayoutfitideas #outfitideas #fallfashion #baggyclothes #streetwear ,7,1698184967,normal,"['jerseyoutfit', 'jerseyoutfitideas', 'everdayoutfitideas', 'outfitideas', 'fallfashion', 'baggyclothes', 'streetwear']",2023-10-24,1.0,1,where’s the pants from pls❤️
7293929346090290464,Unlacedclo,55,702,0,2,3,0,False,Online now! #pink #streetwearde #blokecore #joshiiks #samonsafari #streetwearbelts #colorsmatching #janxcb #outfitinspo #vhsfootage #outfitideas ,12,1698250269,normal,"['pink', 'streetwearde', 'blokecore', 'joshiiks', 'samonsafari', 'streetwearbelts', 'colorsmatching', 'janxcb', 'outfitinspo', 'vhsfootage', 'outfitideas']",2023-10-25,,0,
7294390972476148997,𝑪𝒉𝒂𝒒𝒖𝒊.𝑨𝑪,78,3071,10,7,3,0,False,estilo Blokecore Pt.5👹 #outfitinspiration #blokecore #outfitinspo #fashiontok #fashiontiktok #menfashion #menstyle #outfitideas #blokecoreoutfit ,26,1698357753,normal,"['outfitinspiration', 'blokecore', 'outfitinspo', 'fashiontok', 'fashiontiktok', 'menfashion', 'menstyle', 'outfitideas', 'blokecoreoutfit']",2023-10-26,,0,
7294648290266729734,Lisa,26600,351900,76,84,751,0,False,blokecore-an buat ke everland!! terwujud juga main disana🥲🫶🥹 pasa mau full vlog nya gaa?? #longervideos #blokecore #grwm #everland ,146,1698417659,normal,"['longervideos', 'blokecore', 'grwm', 'everland']",2023-10-27,,0,
7294885207012920577,kendyy_kh,357,45200,4,54,130,0,False,Jersey preorder 🫶🏻✨🖤13$ only 🫧#outfitideas #inspo #viral #ootd #foryou #outfit #y2k #cambodia #fyp #outfitsinspo #y2kaesthetic ,8,1698472825,lower,"['outfitideas', 'inspo', 'viral', 'ootd', 'foryou', 'outfit', 'y2k', 'cambodia', 'fyp', 'outfitsinspo', 'y2kaesthetic']",2023-10-28,5.0,1,😁😁😁
7295007268557393153,nào đông khách sẽ đổi tên,97,9552,2,2,1,0,False,blokecore đi muôn nơii #hitmeup #manchesterunited #blokecore #blokecoreoutfit #classic #vintage #ootd ,9,1698501243,normal,"['hitmeup', 'manchesterunited', 'blokecore', 'blokecoreoutfit', 'classic', 'vintage', 'OOTD']",2023-10-28,3.0,2,live đi anh Anh ơi anh quay clip chỉ cách phối đồ vs áo liv 2006 đi ạ !
7295405411086224658,Sivety-Blokecore,1141,18700,15,10,41,0,False,#blokecore #foryou #blokecorestyle #streetwear #vintage ,14,1698593940,lower,"['blokecore', 'foryou', 'blokecorestyle', 'streetwear', 'vintage']",2023-10-29,,0,
7295786063535017249,Marieanissaxx,146,3999,10,2,4,0,False,Tenue automnale ! 🎀 #automneoutfit #fallfashion #blokettecore #onshabilleensemble #pourtoi ,83,1698682570,normal,"['automneoutfit', 'fallfashion', 'blokettecore', 'onshabilleensemble', 'pourtoi']",2023-10-30,,0,
7295854302910893320,Lilac라일락,62200,1100000,151,726,7017,0,False,Adidas core #adidas #adidastrackjacket #outfitinspo #fallfashion #everydayoutfit #fyp #fypシ ,18,1698698459,normal,"['adidas', 'adidastrackjacket', 'outfitinspo', 'fallfashion', 'everydayoutfit', 'fyp', 'fypシ']",2023-10-30,3.1904761904761907,21,"구매처아는 한국인들 답좀ㅠㅜ 디자인 명 알 수 있을까요ㅠㅜ wow so nice 😲😲😲😲Wow, điều này cũng tuyệt vời 👍👍👍👍This is great👍Điều này cũng tuyệt vời 사이즈는 s 인가요? S ngta mặc đẹp mà t mặc dô nhìn như gơn phố 😭 lieblingsmarke saranin thrift ig yg adaa tracktop kya gini mua ntn v mn ơi 😭 where can i buy it I want to buy adidas jacket in Korea. But I'm in Vietnam, what should I do now? k hỉu kiur j mà mặc vô biến thành girl phố liền สนใจ ini beli dimana ya Size? can someone please tell me which color that is? Adidas naik daun amat 😂 Mua qua mạng dc không ạ🥺🥺🥺 ini namanya adidas apa yaa? pliss kasi tau gww link sản phẩm đi chị ơi Ib"
7296090986046934274,crewsculptor_jp,1462,33800,8,20,243,0,False,女の子っぽくも着れるジャケットみつけた #おすすめ #fyp #fypシ #韓国ファッション #fashion #ootd ,9,1698753565,normal,"['おすすめ', 'fyp', 'fypシ', '韓国ファッション', 'fashion', 'ootd']",2023-10-31,,0,
7296114943382899970,Quanh Co,86,10900,6,8,15,0,False,Nghe nói mặc Jersey đang hot trở lại thì phải 🤔😅 #jersey #TikTokFashion #phoido #outfitIdeas #OOTD #wavychannel #fashion #ootdfashion #goclamdep#viroitrang #xuhuong #fyp ,13,1698759143,normal,"['jersey', 'tiktokfashion', 'phoido', 'outfitideas', 'ootd', 'wavychannel', 'fashion', 'ootdfashion', 'goclamdep', 'vir', 'xuhuong', 'fyp']",2023-10-31,4.0,2,xin link quần ạ áo n mua ở đâu v ạ
7296412979858312480,blokecore.shirt,537,35700,2,36,77,0,False,Disponible en nuestro Instagram 🫶🏻🥷🏻  #fypシ #blokecore #viral #footballshirt #parati ,17,1698828540,normal,"['fypシ', 'blokecore', 'viral', 'footballshirt', 'parati']",2023-11-01,4.0,1,фу
7296416221648391456,blokecore.shirt,6533,66900,25,150,619,0,False,Ya disponible en nuestro insta 🥷🏻🫶🏻 #fypシ #viral #blokecore #milan #parati ,12,1698829293,normal,"['fypシ', 'viral', 'blokecore', 'milan', 'parati']",2023-11-01,,0,
7296531343775780101,<3,524,40400,0,114,174,0,False,#blokecore #tiktokshop #tiktok #tiktokph #blokecoreoutfit #fyp #brazil #jorts #tiktokoutfit #fits #inspo #fashion #fashiontiktok #outfit #outfitideas #streetwear #unisex #affordable #trending #foryoupage #foryou #affiliate #tiktokaffiliate #trend ,16,1698856093,normal,"['blokecore', 'tiktokshop', 'tiktok', 'tiktokph', 'blokecoreoutfit', 'fyp', 'brazil', 'jorts', 'tiktokoutfit', 'fits', 'inspo', 'fashion', 'fashiontiktok', 'outfit', 'outfitideas', 'streetwear', 'unisex', 'affordable', 'trending', 'foryoupage', 'foryou', 'affiliate', 'tiktokaffiliate', 'trend']",2023-11-01,,0,
7297458975757421826,tiemdocu86,105,15400,5,17,42,0,False,Ai bảo #hockey #jersey khó phối đồ nào 😘 #tk2hand #tiemdocu86 #secondhand #thriftshop #blockcore #fypシ #outfit #mixandmatch #styletips #fashion #football #sport ,11,1699072078,normal,"['hockey', 'jersey', 'tk2hand', 'tiemdocu86', 'secondhand', 'thriftshop', 'blockcore', 'fypシ', 'outfit', 'mixandmatch', 'styletips', 'fashion', 'football', 'sport']",2023-11-04,,0,
7297472693614415105,hongfngocc,5920,119700,51,81,369,0,False,Đâu giờ ai chê t #blokecore #xh #fyb #CapCut ,19,1699075269,normal,"['blokecore', 'xh', 'fyb', 'capcut']",2023-11-04,4.666666666666667,3,xin link áo ạ Xink🥰 acp ins vớiiii🥺
7298328020190891269,ichaaaa,1142,37500,24,72,108,0,False,blokecore inspo bonek version xixixi🐊 #BanggaBeliAsli #EverydayJersey,18,1699274414,normal,"['banggabeliasli', 'everydayjersey']",2023-11-06,3.0,1,tutor hijaaabbb
7298343260894809349,BRINGYOURS.CO,1036,31100,33,32,84,0,False,Ootd Y2K💥💥 #outfity2k #ootdy2k #blockcore #opel #inter #intermilan #jersey #baggyjeans #jnco #y2k #jncothailand #jncojeans ,16,1699277962,normal,"['outfity2k', 'ootdy2k', 'blockcore', 'opel', 'inter', 'intermilan', 'jersey', 'baggyjeans', 'jnco', 'y2k', 'jncothailand', 'jncojeans']",2023-11-06,2.2,5,bang apa nama model celananya? brp bang celana y2k nyaa blokccore style?? 🥰🥰🥰 y2k jual?
7298427838066068768,Nicolò Pirlo,4783,84000,47,81,133,0,False,A volte anche i migliori sbagliano #blokecore ,24,1699297655,normal,['blokecore'],2023-11-06,,0,
7298517893908663557,เอาเรื่องจัด,944,56800,0,151,274,0,False,ผู้หญิงใส่แล้วมีเสน่ห์1000% พิกัดในตะกร้านะวัยรุ่น🤘🏿#เทรนด์วันนี้ #แฟชั่น #ไอเดียแต่งตัว #y2k #วัยรุ่นเมกา #คลาสแฟชั่น #swag #เธรด #ฟีด #วินเทจ #สไตล์ฉัน #วัยรุ่นเมกา🇺🇸 #แต่งตัวผู้หญิง #blokecore ,9,1699318623,normal,"['เทรนด์วันนี้', 'แฟชั่น', 'ไอเดียแต่งตัว', 'y2k', 'วัยรุ่นเมกา', 'คลาสแฟชั่น', 'swag', 'เธรด', 'ฟีด', 'วินเทจ', 'สไตล์ฉัน', 'วัยรุ่นเมกา🇺🇸', 'แต่งตัวผู้หญิง', 'blokecore']",2023-11-07,,0,
7298627683846540549,Randymw,444,11900,16,3,73,0,False,Bloke core outfit !! #mensoutfit #mensstyle #outfitideas #whatiwearinaweek #fashiontiktok #outfittiktok ,11,1699344185,normal,"['mensoutfit', 'mensstyle', 'outfitideas', 'whatiwearinaweek', 'fashiontiktok', 'outfittiktok']",2023-11-07,5.0,1,🔥🔥🔥
7298659936945425670,Gina VT,17300,690600,210,213,1334,0,False,Rela jadi gangster buat kamu.  #styling #fashionable #tutorial #fashiontutorial #tutorialfashion #fypシ #fyp #outfit #fashion #fashiontiktok #outfitideas #outfitoftoday #ootd #outfitinspo #fitcheck #fashioninspo #streetstyle #streetwear #blokecore #jerseyoutfit #jerseyoutfitideas #y2k #foryou #gta6 #foryoupage #fashionvideos #bestofstreetwear #gtaviral #gangster #sorryyatipeaku #gta ,22,1699351694,normal,"['styling', 'fashionable', 'tutorial', 'fashiontutorial', 'tutorialfashion', 'fypシ', 'fyp', 'outfit', 'fashion', 'fashiontiktok', 'outfitideas', 'outfitoftoday', 'OOTD', 'outfitinspo', 'fitcheck', 'fashioninspo', 'StreetStyle', 'streetwear', 'blokecore', 'jerseyoutfit', 'jerseyoutfitideas', 'y2k', 'foryou', 'gta6', 'foryoupage', 'fashionvideos', 'bestofstreetwear', 'gtaviral', 'gangster', 'sorryyatipeaku', 'gta']",2023-11-07,2.375,24,"rill og😈 idaman los carlos dikit lagi 😹🗿 ini jatohnya gangster/sewag ini bukan gangster jir ini fashionshow pesona cewk hyper🗿 idaman nya CJ ini mah kok malah jadi hilang😳 itu sabuk apa namanya?? Kak, kalo buang air ribet gak ?😅 gengster kak bukan seteres Anjir😂😂😂 njir typikal ceweknya CJ franklin GTA san andreas 🗿🤣 Gangster geng king the Grove street 4 for life gilrs Indonesia 🇲🇨 green Amerika serikat 🇺🇸🏀🏆👑💚1992 ini gangster mana Grove street, vagos, ballas, da nang boys, 😂😂 😂😂 bukan Grove street itu mah wanjir kaget😂😂😂 keren cuy samba samba😭😭😭👍 jangan bawa tas ih 😅 gangster kak bukan gila😂 kak? samba samba gengseter kak bukan citayem fashion week 🤣🤣 pake ini pas nyanyi dipanggung langsung diturunin"
7299002509484657926,Lpx Retro Apparel,464,27200,10,17,36,0,False,"Membalas @Sky444 cocok ngga sih,? #lpxstudio #jersey #jerseyretro #Jerseyretro #CapCut #fyp #fypシ #blokecore #blokecoreoutfit #retrooutfit #vintagefashion #outfitideas #outfitinspiration #vintageoutfit #blockcorestyle ",16,1699431457,normal,"['lpxstudio', 'jersey', 'jerseyretro', 'capcut', 'fyp', 'fypシ', 'blokecore', 'blokecoreoutfit', 'retrooutfit', 'vintagefashion', 'outfitideas', 'outfitinspiration', 'vintageoutfit', 'blockcorestyle']",2023-11-08,4.0,2,plis kranjang kuning ko gada yang real betis
7299075735631727905,Retro Calcio Shirts,85000,721900,422,1105,10500,0,False,Equipos que no conoces y que tienen camisetones | Episodio 7: #Torreense x @Kappa  🇵🇹 ¿Qué nota le pones? #CamisetasDeFutbol #FootballShirts #RetroCalcioShirts #Futbol #Football #Calcio #FootballKit #Blokecore #FootballFashion #LigaNOS #Kappa #SCUTorreense ,43,1699448510,normal,"['torreense', 'camisetasdefutbol', 'footballshirts', 'retrocalcioshirts', 'futbol', 'football', 'calcio', 'footballkit', 'blokecore', 'footballfashion', 'liganos', 'kappa', 'scutorreense']",2023-11-08,3.2,15,"Ta guapo preciosa que opinas de Cortuluá? guatemala🥰🤗 la juve estubo con kappa tenes que ver el 3ero del Deportivo Saprissa kappa tambien un camiseton las UMBROS del Luton!! Para ir de Gala Lo que hizo Umbro con Santa Fe ❤️ Está en el FC? dónde se pueden conseguir? Buenos diseños Southampton temporada 22-23 Están harto elegantes En Colombia, Kappa patrocinará este año a un equipo pequeño, el Envigado FC"
7299135679110434080,blokecore.shirt,54,4629,2,9,12,0,False,Retro Brasil ya disponible en nuestro insta 🌟 #fypシ #parati #blokecore #outfit #camisetasdefutbol ,11,1699462464,normal,"['fypシ', 'parati', 'blokecore', 'outfit', 'camisetasdefutbol']",2023-11-08,,0,
7299354821100899589,Lpx Retro Apparel,118,9516,10,1,7,0,False,All in persebaya.. #lpxstudio #CapCut #jersey #jerseyretro #Jerseyretro #fyp #fypシ #blokecore #blokecoreoutfit #retrooutfit #vintagefashion #outfitideas #outfitinspiration #vintageoutfit #blockcorestyle ,18,1699513484,normal,"['lpxstudio', 'capcut', 'jersey', 'jerseyretro', 'fyp', 'fypシ', 'blokecore', 'blokecoreoutfit', 'retrooutfit', 'vintagefashion', 'outfitideas', 'outfitinspiration', 'vintageoutfit', 'blockcorestyle']",2023-11-09,3.0,3,bagus🥰😁 persija ga ada kak? persib ada gk
7299507815754845473,blokecore.shirt,139,10000,1,15,33,0,False,Camisetas Fc Barcelona ya disponibles! 🌟🥷🏻  #fypシ #viral #parati #blokecore #outfit ,20,1699549108,normal,"['fypシ', 'viral', 'parati', 'blokecore', 'outfit']",2023-11-09,2.0,1,Size?
7300187292184923424,blokecore.shirt,2005,46800,8,74,238,0,False,Real Madrid retro ya disponible en nuestro insta 🌟 #fypシ #blokecore #viral #parati ,10,1699707313,normal,"['fypシ', 'blokecore', 'viral', 'parati']",2023-11-11,3.0,2,Pfff me flipa @bal
7300548991748443410,Wish@⃝꙰⃝꙰⃝꙰⃝꙰⃝꙰⃝꙰⃝꙰⃝꙰⃝꙰⃝,31800,411600,129,722,2244,0,False,Thử phối đồ cho bạn gái sẽ như thế nào ? #xuhuong #fypシ #fyp #trending #outfitinspo #outfitideas #LearnOnTikTok #aestheticvideos #blokecore #couplegoals ,24,1699791524,normal,"['xuhuong', 'fypシ', 'fyp', 'trending', 'outfitinspo', 'outfitideas', 'LearnOnTikTok', 'aestheticvideos', 'blokecore', 'couplegoals']",2023-11-12,4.0,22,"Yo! ань? 100th commenter Xin in4 quần ạ🥺 mn vô ủng hộ kênh em với xin in4 tai nghe của bn nữ xin in4 quần anh mặc Vô soi vài vid mà h t thấy t mê bồ ổng r bay, đẹp gái quá =))))) in4 quần thứ 2 của a Cute thật🥰 Cho em xin link mua tất với anh🥰🥰 áo thung ba lỗ mua ở đâu v ah Blog này tôi ủng hộ cho e xin if túi đại ca ơii @Kira🫶🏻 😏❤️ @xeamm 😭💗 @A @jev ana 🔥 @hoanggia @h² / 😭✨ @𖧧Maung Phoo🎀 Try? 🥰🥰🥰"
7300560543473995010,Mocass,14,813,0,0,0,0,False,#jersey #ootd #outfit #1m50 #xuhuong #fyp #blockcore #phoido #tipsforgirl #tipforgirl #christmas #noel ,4,1699794215,normal,"['jersey', 'ootd', 'outfit', '1m50', 'xuhuong', 'fyp', 'blockcore', 'phoido', 'tipsforgirl', 'tipforgirl', 'christmas', 'noel']",2023-11-12,,0,
7300729579902094624,Fantral Essentials,723,8799,1,15,67,0,False,🤩#jersey #footballjersey #footballkits #footballshirt #footballshirts #blokecore #fypシ #targetaudience ,10,1699833585,normal,"['jersey', 'footballjersey', 'footballkits', 'footballshirt', 'footballshirts', 'blokecore', 'fypシ', 'targetaudience']",2023-11-12,3.0,1,blockcore>>>
7300747917428575530,jit.liwag,38,706,0,0,4,0,False,Comment your favorite aesthetic 👀 #fyp #foryou #viralvideo #style #workwearstyle #streetwear #blokecore ,9,1699837851,normal,"['fyp', 'foryou', 'viralvideo', 'style', 'workwearstyle', 'streetwear', 'blokecore']",2023-11-13,,0,
7300748879811661088,Fantral Essentials,189,3090,0,0,18,0,False,🤩#jersey #footballjersey #footballkits #footballshirt #footballshirts #blokecore #targetaudience #fypシ ,10,1699838093,normal,"['jersey', 'footballjersey', 'footballkits', 'footballshirt', 'footballshirts', 'blokecore', 'targetaudience', 'fypシ']",2023-11-13,,0,
7300938020457385217,Mocass,41,2838,1,9,17,0,False,#jersey #ootd #outfit #1m50 #xuhuong #fyp #blockcore #phoido #tipsforgirl #tipforgirl #christmas #noel ,10,1699882105,normal,"['jersey', 'ootd', 'outfit', '1m50', 'xuhuong', 'fyp', 'blockcore', 'phoido', 'tipsforgirl', 'tipforgirl', 'christmas', 'noel']",2023-11-13,5.0,1,🥰🥰
7300957161314651410,Phối đồ cùng MEW,1716,104300,21,74,425,0,False,Mờ ê mê V~ lunnnnn 🔥#xuhuong #outfit #thoitrangnam #style #xh #fyp #phoido #viral #phoidonam #fashion #outfits #outfitideas #phoidocungmew #learnontiktok ,17,1699886558,normal,"['xuhuong', 'outfit', 'thoitrangnam', 'style', 'xh', 'fyp', 'phoido', 'viral', 'phoidonam', 'fashion', 'outfits', 'outfitideas', 'phoidocungmew', 'learnontiktok']",2023-11-13,5.0,1,😆😆😆
7301632635309149446,Baron73,6049,90700,40,135,753,0,False,Football Jersey.  #fypシ゚viral #blokecoreoutfit #fypシ ,19,1700043829,normal,"['fypシ゚viral', 'blokecoreoutfit', 'fypシ']",2023-11-15,4.5,8,พิกัดกางเกงชุดแรกหน่อยครับ พิกัดกางเกงหน่อยพี่ Straight 🔥 Áo Nhật số 22 nhieu shop พิกัดกางเกงหน่อยค้าบ @2wul 👌🏼 🔥 aibo un cinese
7301765242256706821,Club de Jerseys,6595,327000,154,3323,1779,0,False,Manchester united 08 || Cristiano Ronaldo jersey #blokecore #clubdejerseysmx #cristianoronaldo #manchesterunited ,14,1700074705,normal,"['blokecore', 'clubdejerseysmx', 'cristianoronaldo', 'manchesterunited']",2023-11-15,3.6206896551724137,29,"como la compro precio cómo lo compro? Como la puedo comprar? precioo yo quiero una como la compro Precio 🤔🤔 cual es el precio ? 😫😫 A España hacéis envíos? Como la comprooo porfavor envios ah Guate? precio ? Como la consigo bro , me ayudas cómo la compraste amigo?? cómo la puedo comprar yo tengo ese y el rojo bro tienes de niño para comprarla hacen envios a México??? en la página se puede poner el parche de la premier como en el vídeo? Es q no me sale precio me la podría hasta para dormir 🤩 yo tengo ese polo...pero con el nombre de ronney Está disponible en manga corta y como se compra como lo puedo con seguir Quiero una así!!! Como la compro? Cuál es mejor, esta o la roja? who here looking for ishowspeed comment Are you looking for İSHOW SPEED too? 😂"
7302070835286740231,Football Fandom ID,12100,415800,42,71,1015,0,False,"Soal bloke core, Jacson Irvine jagonya deh #jacksonirvine #stpauli #footballfandom #blokecore #fandomid #fyp",88,1700145950,normal,"['jacksonirvine', 'stpauli', 'footballfandom', 'blokecore', 'fandomid', 'fyp']",2023-11-16,3.2,20,"hc juga a jackson anda melupakan Hector Bellerin Kurang kalcer apalagi ini, clubnya aja dah st.pauli 😅 ini yg disapa casemiro bukan? Saingan bellerin soal gaya😂 gas lawan Justin hubner besok pas 16 besar..jangan kasih kendor block core rambut gondrong emang cadasss sii klub nya aja st pauli ☠️ Boston hc juga a irvine tp tuaan Irvine dr ballerin menurutku Dy lbh pengalaman dr ballerin tetap keren Pemain australi fav gw😎 klo di Australia ada irvine,di indonesia ada bang Baud Irvine ngomong sendiri 😭 diakan pemaen band metal kelebihan mereka karena federasi bagus kedua bahasa bawaan bahasa inggris jadi gampang xhaveheartx lebih skena ucup bajuri lah Aslinya abang abangan mid west andalan gua di hull dulu"
7302362670420790534,Lpx Retro Apparel,658,21600,36,4,61,0,False,Replying to @~𝑰𝒍𝒉𝒂𝒎𝒎𝒎 bukan fans karbitan apa lagi bocil fomo.. #lpxstudio #CapCut #jersey #jerseyretro #Jerseyretro #fyp #fypシ #blokecore #blokecoreoutfit #retrooutfit #vintagefashion #outfitideas #outfitinspiration #vintageoutfit #blockcorestyle ,19,1700213804,normal,"['lpxstudio', 'capcut', 'jersey', 'jerseyretro', 'fyp', 'fypシ', 'blokecore', 'blokecoreoutfit', 'retrooutfit', 'vintagefashion', 'outfitideas', 'outfitinspiration', 'vintageoutfit', 'blockcorestyle']",2023-11-17,1.0,6,keren asli indo gaada min? N via shopee ada ga bang? bisa nambah nickname mas? toko nya apa?
7302385174178745605,Yogiprma,22600,868000,288,124,1356,0,False,#menoutfitideas #inspooutfit #baggyjeans #blokcoreoutfit ,33,1700219043,normal,"['menoutfitideas', 'inspooutfit', 'baggyjeans', 'blokcoreoutfit']",2023-11-17,2.5517241379310347,29,bang lu nyari jerseynya dimane celana nya jinsoo ya bang dulu pas lagi booming tahun 2013an style yg menurut gw bagus itu pakai celana jersey basket atasan jaket kombor pakai topi🙏 nama celananya apa bang beli dmn itu kirang adidas mas sepatu ne bang coba skena saiz berapa bajunya bg? spil celana nya beli dmn bg out fit def jam kak coba cowo bumi bang mana out fit def jam nya kak kereeen🫦🫵 style pakai Hoodie bg terus pakai sepatu cb simpel tapi kece bg salvok Hoodie ny 😆 bg cob a hc menurut gua org yg cocok nge style tingginya 180+ spill sepatu kalo gue kek gitu auto kek pemulung [disdain] spil celana duhhhh celana nya spil celana nya celana nya beli di mana bang? JEANSSS PLEASEEEE BELI DMNN keren sih malah mau nguli spill celana bang aksesoris yang di celana beli dmna?? kece ngab
7303326013113601313,Fantral Essentials,1237,19900,4,28,118,0,False,🤩#jersey #footballjersey #footballkits #footballshirt #footballshirts #blokecore #targetaudience #fypシ ,12,1700438111,normal,"['jersey', 'footballjersey', 'footballkits', 'footballshirt', 'footballshirts', 'blokecore', 'targetaudience', 'fypシ']",2023-11-19,5.0,1,Ac Milán 13/14 😍😍
7303326416983182625,Fantral Essentials,42,624,2,0,1,0,False,🔥#jersey #footballjersey #footballkits #footballshirt #footballshirts #blokecore #targetaudience #fypシ ,10,1700438210,normal,"['jersey', 'footballjersey', 'footballkits', 'footballshirt', 'footballshirts', 'blokecore', 'targetaudience', 'fypシ']",2023-11-19,5.0,1,Can you follow back real quick I want to ask you smth?
7303428792771415301,LYSTIA Novilda,5806,220800,36,89,249,0,False,how we style #jersey or #blokecore outfit ⚽️😆 #notsponsored #gayaditiktok #tiktokfashion #blokecoreoutfit #coupleoutfit ,47,1700462031,normal,"['jersey', 'blokecore', 'notsponsored', 'gayaditiktok', 'tiktokfashion', 'blokecoreoutfit', 'coupleoutfit']",2023-11-20,4.25,4,Apa daya aku yg cm bisa dpt trift Kiyowwwwooo🤣 too cuteeeeeee 😁
7303613148227980576,Nicolò Pirlo,2988,61800,30,49,100,0,False,Joe Jonas con la maglia di Del Piero: bocciato o promosso? #blokecore ,38,1700504956,normal,['blokecore'],2023-11-20,5.0,2,è proprio contento Allegria portami via😂
7303852124020985094,Lpx Retro Apparel,38,7186,2,1,2,0,False,Replying to @MarCooo love you too🥰🥰 #lpxstudio #CapCut #jersey #jerseyretro #Jerseyretro #fyp #fypシ #blokecore #blokecoreoutfit #blokecoreoutfit #retrooutfit #vintagefashion #outfitideas #outfitinspiration #vintageoutfit #blockcorestyle ,22,1700560595,normal,"['lpxstudio', 'capcut', 'jersey', 'jerseyretro', 'fyp', 'fypシ', 'blokecore', 'blokecoreoutfit', 'retrooutfit', 'vintagefashion', 'outfitideas', 'outfitinspiration', 'vintageoutfit', 'blockcorestyle']",2023-11-21,,0,
7304210271063543045,Lpx Retro Apparel,215,14100,14,5,31,0,False,Membalas @Dullzzsss bisa pake banget..#lpxstudio #CapCut #jersey #jerseyretro #Jerseyretro #fyp #fypシ #blokecore #blokecoreoutfit #retrooutfit #vintagefashion #outfitideas #outfitinspiration #blockcorestyle #carapesan ,24,1700643983,normal,"['lpxstudio', 'capcut', 'jersey', 'jerseyretro', 'fyp', 'fypシ', 'blokecore', 'blokecoreoutfit', 'retrooutfit', 'vintagefashion', 'outfitideas', 'outfitinspiration', 'blockcorestyle', 'carapesan']",2023-11-22,3.0,5,RRQ = Rex Regum Neon😭😭 custom satuan bisa min ? kalo mau Sriwijaya FC retro bisa? Argen ka jerman 😁
7304442686256188678,Fakethrift_id,535,7669,1,21,56,0,False,Inspirasi outfit blockcore #blockcorestyle #blockcore #y2k ,8,1700698096,normal,"['blockcorestyle', 'blockcore', 'y2k']",2023-11-23,5.0,1,@MaxZie @Hamdan 27
