id,username,likes,views,comments,shares,collects,repost,isCommerce,description,duration,created_at,VideoQuality,hashtags,date,sentiment,comment_count,accumulated_text
7414988466095770898,sportfit,4114,60000,25,406,840,0,False,برشلونه 2008/2009 #blokecore #foryou #messi #تيشيرت ,14,1726436554,normal,"['blokecore', 'foryou', 'messi', 'تيشيرت']",2024-09-15,3.6842105263157894,19,الحين اقددر اطلب بدون علامه الصليب؟ وادفع عليها زياده ولا بكم عروضض يوم وطني مافي؟ عندي نفسه / السداسية ماكو مثله 😍 عندي نفسه🫦 مالقيته بالموقع؟ في توصيل لي موريتانيا 🇲🇷 ابيي💔 متى توفرون S ? نبي تيشيرت برشلونه الجديد المكان دا في مصر توصلون الشرقيه؟ @N @Taleen 🦋 جييبو لي هدية @Khaled El3bsawy الديتيلز 💔 @سُرور الخَفاجي 🤍. ❌❌❌❌❌❌❌❌ في نص كم I want …..
7415056666502155526,Keceoutfit.id,139,4514,0,1,15,0,False,#keceoutfit #casualoutfit #casual #ootdinspiration #ootdinspo #outfitinspo #outfitinspiration #kece #style #homiesstyle #jerseyoutfit #shortpants #CapCut ,15,1726452425,normal,"['keceoutfit', 'casualoutfit', 'casual', 'ootdinspiration', 'ootdinspo', 'outfitinspo', 'outfitinspiration', 'kece', 'style', 'homiesstyle', 'jerseyoutfit', 'shortpants', 'capcut']",2024-09-16,,0,
7415092228852436230,Karbida_fc,1368,82200,27,15,54,0,False,Coba rate 1-10 👇🏼 kalo gw sih suka banget sama ini jersey 🥰 #jersey #vintage #blokecore #ligainggris #olahraga ,32,1726460708,normal,"['jersey', 'vintage', 'blokecore', 'ligainggris', 'olahraga']",2024-09-16,3.15,20,"pertama bang reno 🔥 keren sih jersey blackburn dulu. pedersen keren bang namesatenya Jersey Chievo Verona bang @paluani 1_10 gw kasih rating 9 bang 95...juara Blackburn no 4.. Tim Sherwood 👍🔥 punya ni yg cis, detailnya bagus ada watermakrnya Shearer dan Chris Sutton bang kapan ada give away, atau abang jual gitu diskon 50%😥 keren bang pake patch 94 95 champions bisa juga kan ya? pencinta retro sunderland, kevin phillips lah 😁 banggg gue sangat fansssss luuuu spill celana bg😁 bang jersey liga indonesia ada ga Bang ente gak ada give away buat followers Abang nih hehe😅😅 belinya di mana sih bang baguss bet cuyy bangggg"
7415230891137568008,Faris N,74,3715,4,15,8,0,False,"Outfit jersey bloke core style adalah tentang gabungan pakaian sukan kasual dengan fesyen harian yang berani. Mulakan outfit jersey bloke core style dengan jersey oversized, berikan vibe yang santai dan relaks. Padankan jersey dengan jeans baggy untuk lengkapkan penampilan cool dan effortless bagi outfit jersey bloke core style. Untuk tambah sentuhan sofistikasi yang tidak dijangka, lengkapkan outfit jersey bloke core style dengan loafers hitam, yang mengimbangkan elemen kasual. Gabungan ini menjadikan outfit jersey bloke core style sempurna untuk sesiapa yang mahu kelihatan bergaya sambil mengekalkan keselesaan dan kesederhanaan.  @NEONATE COMPANY  #Neonate10Years #NeonateCompany #NeonateNeoWave #NeonateEverywhere #jersey #jerseyoutfit #blokecore #blokecoreoutfit ",53,1726492986,lower,"['neonate10years', 'neonatecompany', 'neonateneowave', 'neonateeverywhere', 'jersey', 'jerseyoutfit', 'blokecore', 'blokecoreoutfit']",2024-09-16,4.333333333333333,3,loafer beli mana ek besarnya s Booommm! Thank you broo! 🔥🔥🔥
7415237090255949089,Retro Calcio Shirts,309,4433,6,3,9,0,False,Todos los Detalles del nuevo Away Kit de @Soka y @SD Huesca para la temporada 2024-25 👀 Toma inspiración del pirineo aragonés y está llena de detalles 🔝 ¿Qué nota le pones? #CamisetasDeFutbol #FootballShirts #RetroCalcioShirts #Futbol #Football #Calcio #FootballKit #Blokecore #Retro #Vintage #FootballFashion #Soka #HomeKit #SokaFootball #EASports #SDHuesca #Huesca #Aragon #BrandNew #Champions #ChampionsLeague #Unboxing #custom #LaLiga #oficial #Review #Reseña #Camiseta,51,1726494436,normal,"['camisetasdefutbol', 'footballshirts', 'retrocalcioshirts', 'futbol', 'football', 'calcio', 'footballkit', 'blokecore', 'retro', 'vintage', 'footballfashion', 'soka', 'homekit', 'sokafootball', 'easports', 'sdhuesca', 'huesca', 'aragon', 'brandnew', 'champions', 'championsleague', 'unboxing', 'custom', 'laliga', 'oficial', 'review', 'reseña', 'camiseta']",2024-09-16,1.0,1,"Coke cual me pillo, esta o la azulgrana?"
7415295242011757829,TomTomi.,31,1653,0,0,5,0,False,Indonesia blokecore Jersey outfit green and white #recomendasioutfit #blokecoreoutfit #blokecore #timnasindonesia🇮🇩 #timnasindonesia #outfit #ootd #mills #capcut ,9,1726507972,normal,"['recomendasioutfit', 'blokecoreoutfit', 'blokecore', 'timnasindonesia🇮🇩', 'timnasindonesia', 'outfit', 'OOTD', 'mills', 'capcut']",2024-09-16,,0,
7415301700040330504,ID_Jersey_Enthusiast,2,392,2,0,0,0,False,"Admiring Napoli Home Kit 2019/20,  which represent a great season for them by winning Coppa Italia under leadership of Carlo Ancelotti and continued by Gennarp Gattuso. Great Kappa Jersey with Kombat technology and design based on traditional Napoli sky blue color, added with pattern all over the shirt with a light blue color gradation, forming a jersey that make statement for Napoli's fans especially with a strong squad like Callejon, Milik, Mertens, Insigne, Fabian Ruiz, Koulibaly, Manolas and etc. A great one wear especially with modern Kappa design that are fresh...!! #napolihomekit #napolihome2019 #napolihome #napoli2019 #blokecore #blokecoreoutfit #blokecorefashion #footballjersey #footballjerseylovers #kappanapolihomejersey #serieaitalia #casualwear #soccerjersey #footballkit #footballkits #cooljerseydesign #jakartajersey #jerseycommunity #indonesiajerseycommunity #indonesiajerseycollector #blokecoreindonesia #kappanapolikit #kappanapoli #napolijersey #euro2024 ",22,1726509477,normal,"['napolihomekit', 'napolihome2019', 'napolihome', 'napoli2019', 'blokecore', 'blokecoreoutfit', 'blokecorefashion', 'footballjersey', 'footballjerseylovers', 'kappanapolihomejersey', 'serieaitalia', 'casualwear', 'soccerjersey', 'footballkit', 'footballkits', 'cooljerseydesign', 'jakartajersey', 'jerseycommunity', 'indonesiajerseycommunity', 'indonesiajerseycollector', 'blokecoreindonesia', 'kappanapolikit', 'kappanapoli', 'napolijersey', 'EURO2024']",2024-09-16,5.0,1,gak pernah gagal🔥🔥🔥
7415479800569072902,Soulstreet.id,359,18500,2,61,68,0,False,the gang!✨🔥 #jerseys #outfitinspo #ootd #bestfriends ,15,1726550945,normal,"['jerseys', 'outfitinspo', 'ootd', 'bestfriends']",2024-09-17,1.0,1,@imy napa ey
7415505777760177415,huthaiifaa,2023,51100,30,63,253,0,False,Grwm with this mesh jersey from @The Game Dept 🤩,10,1726556990,normal,[],2024-09-17,3.3,20,1st pants from? another tuff fit 🔥🔥 im inlove with hazzoof🤩 boss??? 🫶🏼🫶🏼 recommend size for 5’7 73kg boss anong size ng jersey shirt oversized crop?or true to size shoe name po? shoes name lot hehe White shirt from? jersey fyee how tall and what size jerswy what’s ur shoes bro? next dream shoe 🔥👑 height and size jersey? Nice fit bro🔥 🥰🥰🥰 🔥 😍💯
7415533032716668166,William Clarence,1316,56100,21,55,135,0,False,Unboxing jersey Y3 lagi guys!🇯🇵 #footballtiktok #footballshirt #blokecore #fypシ #fypage ,36,1726563338,normal,"['footballtiktok', 'footballshirt', 'blokecore', 'fypシ', 'fypage']",2024-09-17,2.7333333333333334,15,"2XL? Baru beli kemaren yang versi replika, selain lebih murah juga ada tanda tangan Yohji Yamamoto Jadi Jepang vs Indo pake ini atau Erspo? di jpn lgsg nya short sleeve nya 1jt 300 kemaren baru liat . di xebio sports Pakek name set Mitoma bg🔥 komen ke 2 bg kalo ada sepill Jersey Barca 2001 away keren🔥 Bagusan polosan atau pake nameset kalo jepang bang? DAMNNN NN🔥🔥🔥 dari dulu kalo soal desain ...jersey jepang ga pernah gagal, selalu keren desain ny. unboxing jersey barca pliss 😁😁😁 1 🔥🔥🔥"
7415535950106742021,Adit,482,17800,11,12,43,0,False,Oasis inspired outfits🌟🩵 #outfit #fashion #oasis #outfitoftheday #mancity #blokecore #fyp ,20,1726564016,normal,"['outfit', 'fashion', 'oasis', 'outfitoftheday', 'mancity', 'blokecore', 'fyp']",2024-09-17,2.3333333333333335,6,buatin outfit old money bang spil celana jersey beli dimana bang? What is the name of the pants? jersey beli dmn? Spil kacamata der
7415539383480225030,Casualfootball,1,627,1,2,0,0,False,Membalas @zyycx0809 nih rekomendasi jersey vintage France #france🇫🇷 #blokecore #jerseyvintage #football #fyp ,14,1726564818,normal,"['france🇫🇷', 'blokecore', 'jerseyvintage', 'football', 'fyp']",2024-09-17,1.0,1,tar bang dh terlanjur co yg real Madrid
7415547767092759813,Vintage Football Store,115,5352,1,21,32,0,False,Manchester City🏴󠁧󠁢󠁥󠁮󠁧󠁿 home football shirt👕⚽️ #footballshirt #vintagefootballshirt #soccer #soccerjersey #blokecore #manchestercity #style #girl #fashion ,15,1726566767,normal,"['footballshirt', 'vintagefootballshirt', 'Soccer', 'soccerjersey', 'blokecore', 'manchestercity', 'style', 'girl', 'fashion']",2024-09-17,5.0,1,😁
7415551780785769734,Karbida_fc,766,29000,23,6,24,0,False,Siapa pemain Atalanta yang paling nancep di kepala lo?  #jersey #vintage #blokecore #atalanta #italia #olahragatiktok ,87,1726567702,normal,"['jersey', 'vintage', 'blokecore', 'atalanta', 'italia', 'olahragatiktok']",2024-09-17,3.4,20,fillipo inzaghi atalanta🔥🔥🔥 crristian Doni 27 Atlanta 🔥🔥🔥 pake jersi persib bang baju dulu ademona lookman org dulue paham bgt liga Italia serie a.ytta... inzaghi ventola striker ganteng pada masanya ilicic zapata kumhaa akus teu mang berati tahun 2000an christian vieri Jossip Illicic 🔥🔥 Pertama Jersey mu keren bang klw ada yg kecil oper sini bang komen pertama nh 😅😅 cristiano doni🔥 taibi mau dong abang ku... duh .. enak ya kalo bisa beli legend.... yang lazio dong bang... tag ke ane ya paling googling doang 😂 tapi ampas di inter bang
7415600815592836370,KAIN Jersey,13,1315,7,7,4,0,False,"Barcelona third kit 24/25 🔥🔥🔥 Lựa chọn sắc xanh tượng trưng cho hi vọng và sự tái sinh, Barcelona trình làng mẫu áo thứ ba, nhân dịp kỷ niệm 125 năm lịch sử đội bóng 💚 #barcelona #barca #fcbarcelona #fcbarcelona🔵🔴 #viscabarca #catalunya #blaugrana #fcb #jersey #blokecore #footballshirt #footballjersey #football #xuhuong #viral #championsleague2024 #c1 #laliga ",22,1726579115,normal,"['barcelona', 'barca', 'fcbarcelona', 'fcbarcelona🔵🔴', 'viscabarca', 'catalunya', 'blaugrana', 'fcb', 'jersey', 'blokecore', 'footballshirt', 'footballjersey', 'football', 'xuhuong', 'viral', 'championsleague2024', 'c1', 'laliga']",2024-09-17,1.5,4,Shop bán ko Mình xin giá bộ này với Xin giá Màu này đỉnh quá 😍
7415611255811001608,sportfit,1303,24200,19,241,397,0,False,ريال مدريد 2006b🖤 #ريال_مدريد #blokecore #CR7  #explore ,18,1726581546,normal,"['ريال_مدريد', 'blokecore', 'cr7', 'explore']",2024-09-17,2.7777777777777777,9,عندكم طباعه ؟ بكم كيف طريقة الطلب ايش نوع القماش؟ حبيتت واوووو متى يتوفر s @N وفروا سمول
7415729988424551698,ID_Jersey_Enthusiast,8,3041,0,1,1,0,False,"Admiring Mancheste United Away Kit 2024/25  which being used on the new season as FA Cup defending champions. Classical touch with dark navy based Adidas jersey, added details of M monogram watermark all over the jersey, contrasted with silver coloring the ornaments and the adidas 3 stripes on the shoulder and arms. Great one to wear, especially with a long sleeves, really classy !!! #manutdaway #manutdaway2024 #manutdawaykit #manchesterunitedawaykit2024 #blokecore #blokecoreoutfit #blokecorefashion #footballjersey #footballjerseylovers #adidasmanchesterunited #epl2024 #casualwear #soccerjersey #footballkit #footballkits #cooljerseydesign #jakartajersey #jerseycommunity #indonesiajerseycommunity #indonesiajerseycollector #blokecoreindonesia #adidasmanutdkit #adidasmanutd #manutd #manutdjersey #manchesterunited #euro2024 #facupwinners #facupwinner2024 ",21,1726609199,normal,"['manutdaway', 'manutdaway2024', 'manutdawaykit', 'manchesterunitedawaykit2024', 'blokecore', 'blokecoreoutfit', 'blokecorefashion', 'footballjersey', 'footballjerseylovers', 'adidasmanchesterunited', 'epl2024', 'casualwear', 'soccerjersey', 'footballkit', 'footballkits', 'cooljerseydesign', 'jakartajersey', 'jerseycommunity', 'indonesiajerseycommunity', 'indonesiajerseycollector', 'blokecoreindonesia', 'adidasmanutdkit', 'adidasmanutd', 'manutd', 'manutdjersey', 'manchesterunited', 'EURO2024', 'facupwinners', 'facupwinner2024']",2024-09-17,,0,
7415792210815307016,Áo Retro Cổ Điển,1120,75700,106,56,103,0,False,"Liverpool 1993, đậm chất cổ điển. #aoretrocodien #aobongdaretro #aoretro #blokecore #aobongda ",16,1726623682,normal,"['aoretrocodien', 'aobongdaretro', 'aoretro', 'blokecore', 'aobongda']",2024-09-18,3.3,20,Donde la tienda bn v a Giá bao nhiêu vậy đặt hàng sao vậy shop Áo bnhieu vậy shop son heung min số 7 không shop Giá bbhiu ạ Xin giá Có ship qua nhật k shop Mua sao shop Còn ko shop 65kg 1m7 giá nhiu shop Gia bao nhiu shop sao mua Muốn mua s ạ shop Liverpool có mấy mẫu v shop Xin giá Này áo mới hay 2 hand Giá nhiêu z ib
7415823037309783302,opsiformisqin,967,80000,26,18,29,0,False,Outfit bloke core ku siap meramaikan tribun & tempat tempat ngopi 😋 #unboxing #jerseytimnas #blokecore #mills #CapCut ,22,1726630858,normal,"['unboxing', 'jerseytimnas', 'blokecore', 'mills', 'capcut']",2024-09-18,2.3333333333333335,12,"langsung bikin video ootdnya dong beli dimana bang ? di officialnya kok gaada yg jersey home merah Bang link beli nya dimana? bagusan yang mills apa erspo? dapet di harga berapa bang? bang,bahan namesetnya bagus ga? Kobisa dapettt😭😭😭 tb bb berapa bang ambil ukuran L? keren cooo jd pengen aku @zeeryuu nih cuma Mills yg benar-benar serius tentang timnas, sisanya ampas erspo harga sejuta tpi packagingnya cmn paperbag aja tanpa sertifikat 🗿"
7415837284131474696,ID_Jersey_Enthusiast,7,1140,1,0,0,0,False,"Admiring AS Roma Third Kit 2001/02,  Great Kappa Jersey with unique and special design choice of dark blue colors, topped with vibrant orange surround the collars and inside arms, make this jersey as a statement to wear, Another 23 years old Jersey in the collection, especially with ""the prince of rome"" Fransesco Totti (10) at the back...!!! #asromathirdkit #asromathird2001 #asromaaway #asroma2001 #blokecore #blokecoreoutfit #blokecorefashion #footballjersey #footballjerseylovers #kappaasromathirdjersey #serieaitalia #casualwear #soccerjersey #footballkit #footballkits #cooljerseydesign #jakartajersey #jerseycommunity #indonesiajerseycommunity #indonesiajerseycollector #blokecoreindonesia #kappaasromakit #kappaasroma #asroma #asromajersey #seriea2001",23,1726634173,normal,"['asromathirdkit', 'asromathird2001', 'asromaaway', 'asroma2001', 'blokecore', 'blokecoreoutfit', 'blokecorefashion', 'footballjersey', 'footballjerseylovers', 'kappaasromathirdjersey', 'serieaitalia', 'casualwear', 'soccerjersey', 'footballkit', 'footballkits', 'cooljerseydesign', 'jakartajersey', 'jerseycommunity', 'indonesiajerseycommunity', 'indonesiajerseycollector', 'blokecoreindonesia', 'kappaasromakit', 'kappaasroma', 'asroma', 'asromajersey', 'seriea2001']",2024-09-18,3.0,2,kerenn ini seger bener
7416124578084228358,Alexandra Liñan,8466,64000,117,491,953,0,False,"Día 1 de 7 de outfits blokecore ⚽🖤 . El blokecore es una tendencia que impulsa a usar camisetas/chaquetas deportivas (especificamente de fútbol) pero combinándolas con ropa urbana o inclusive con prendas más elegantes para crear un contraste interesante, logrando un equilibrio entre lo casual y lo sofisticado. O en pocas palabras: es la manera más ""fashion"" de vestir camisetas deportivas. . ¿Se animarían a probar esta tendencia? . #fashion #inspo #blokecore #blokette #blokecoreoutfit #fashioninspo #style #look #ootd #outfit #outfitideas #moda #model #beauty #viral #contentcreator #ugc #fypシ゚viral #fy #fyp ",9,1726701071,normal,"['fashion', 'inspo', 'blokecore', 'blokette', 'blokecoreoutfit', 'fashioninspo', 'style', 'look', 'OOTD', 'outfit', 'outfitideas', 'moda', 'model', 'beauty', 'viral', 'contentcreator', 'ugc', 'fypシ゚viral', 'fy', 'fyp']",2024-09-18,4.0,20,uno con la de boquitaaa 💙💛 AMEEE me encantó! amoooo KHE Ameeee amoooooo 💖 Amo Me encantaaaa Alaaaaa 😍✨ Que bellaaaa Xaooooo buenísimo Amoooo Reinaaaa Fabulosaaa💖 Me encanto 🫶🏻 Amo ame totalmenteeeeeeeeeeeeee si le sabe 🤩🤩
7416171627832020230,Sergio León,168,2918,5,2,24,0,False,Transformé un jersey del PSG en un corset y en una bolsita ✂️🧵♻️ Qué otro jersey quieren que transforme?  . . . . . . . #fashiondesigner #diseñodemoda #psg #upcycling #blokecore ,22,1726712025,normal,"['fashiondesigner', 'diseñodemoda', 'psg', 'upcycling', 'blokecore']",2024-09-19,3.4,5,waoo me encanta Lindo 😍. ❤️‍🔥❤️‍🔥 jamás 😂 😂😂 y que meta un autogol😅😅😅😅😅
7416230074338364678,maeson ⋆｡°‧★,71900,864400,299,3674,17500,0,False,Who else love jersey but hates the fabric…🙂‍↔️ Athletic Tee is the solution 🙇‍♀️💖 #jersey #blokecore #coquette #pinterestaesthetic #explore ,17,1726725635,normal,"['jersey', 'blokecore', 'coquette', 'pinterestaesthetic', 'explore']",2024-09-19,2.8,20,"yang lengan panjang varian warna nya banyak kan kakk 🥺🥺 keranjang kuningnya mana cantikkk waaaaaaaaaaaaaa dreeam kk adain ld 120 kk pengen, lucu bgt😭🙏 i want😭😭😭 PLS KAK SHIP KE MALAYSIA JUGAAA😭🙏🙏 info link plissss🥰 KAK TOKO OREN NYA APAAAAA kak gaada di toko oren yaa? adain dunggg ada oren nya ngga? cantik bangeet😭 belinya dimana?? butuh keranjang kuningg😭😭 aaaa mauuu😭 bagus bagus semua lagii, sabar ka aku nabung doloo 😭😭 ayoo kak ship ke malaysia 😭🙏🏻🙏🏻 kakkk beli dimana🥺😭 plssss spilll louh kak😫😫😫 Beli dmn woi bagus semuaa, beli dimanaaaa po kah? btw mau link toko oren ada ga ua"
7416241808142814469,opsiformisqin,23,1145,0,0,0,0,False,"Brazil jersey is good, but Indonesia jersey is very beautiful #blokecore #mills #jerseytimnas #fyp ",14,1726728367,normal,"['blokecore', 'mills', 'jerseytimnas', 'fyp']",2024-09-19,,0,
7416264866488519954,Áo Retro Cổ Điển,64,6247,8,1,7,0,False,Phải Fan cứng Chelsea mới biết đây là áo năm nào 😝 #aoretrocodien #aobongdaretro #aoretro #blokecore #aobongda ,20,1726733728,normal,"['aoretrocodien', 'aobongdaretro', 'aoretro', 'blokecore', 'aobongda']",2024-09-19,3.0,3,Giá tn và sh mình ở đâu v ạ Mua lh sao giá shop oi
7416326272609029382,William Clarence,1211,46400,17,133,162,0,False,Ronaldo 2008… ❤️‍🩹 #footballtiktok #footballshirt #blokecore #manchesterunited #cristianoronaldo ,10,1726748028,normal,"['footballtiktok', 'footballshirt', 'blokecore', 'manchesterunited', 'cristianoronaldo']",2024-09-19,3.4705882352941178,17,"amazing. baru punya Away 2007-08 Black Sweet. siapa tau ada rejeki pasti kebeli. soalnya Banyak yang nyari hoje eu conheci a inveja Beli dimana buaaangggg 🤤 Best united kit ever, bersyukur pernah punya walaupun all remake😂 yg ngg ada namanya di belakang ada ngg bang where did you buy it from!? Còn bán ko bạn harga brapa mas bagus yg warna hitam keren panutan 🥹🥹🥹 warbiasah 👍👏👏👏 🥰🥰🥰 @lehijamesstore El mejor fue es y será por toda la eternidad nuestro comandante nuestro CR7 Cristiano Ronaldo Dos santos Aveiro nuestro comandante El mejor de todos😎👑🇵🇹🐐🇵🇹👑😎Siuuuuu💜 penyakit nameset velvet yellowing ya bang? 😂😂😂"
7416330911215652128,Dommmy,159,4028,1,2,5,0,False,Swapping City Nights for Hikes #fypシ #fyppppppppppppppppppppppp #hiking #wildcamping #sidequest #bloke #blokecore #aesthetic #lifestyleaesthetic ,14,1726749110,normal,"['fypシ', 'fyppppppppppppppppppppppp', 'Hiking', 'wildcamping', 'sidequest', 'bloke', 'blokecore', 'aesthetic', 'lifestyleaesthetic']",2024-09-19,5.0,1,:)
7416448229417438469,Natalia,2044,32300,57,109,131,0,False,¿Cómo vestir camisetas de fútbol? 👀👕⚽️ ¡aquí te muestro una opción!  #blokecore #camisetasdefutbol #grwm #moda #outfitinspo #outfitsideas ,38,1726776422,normal,"['blokecore', 'camisetasdefutbol', 'grwm', 'moda', 'outfitinspo', 'outfitsideas']",2024-09-19,3.8,20,"🩵🩵🩵 Amo Un 10 🤝 hermosaaaaaaaa Hermosoo😫 me encantaaa muy lindaaa💐 demasiado cute ✨ hermosa preciosa 💞💞💞 chao, qué linda 💐 Ahhhhhh bello!!!! Amo tu cabello!!!!!!! pero esa camiseta es de un equipo...?? Dnd compraste la polera un pañuelito y 10/10 🌟 Amo esa poleraaaa 😍 Me encantó el lookcito! una pregunta, comprar telfar en chile es muy dificil/caro?😔 Solo la cartera no me gustó… 👍 me encantaaaa, aquí una albita que lo intentará 💖✨ y esa camiseta tan preciosaaa d donde es? 💎 ¿Que opinamos? 🫢"
7416530462669163783,Áo Retro Cổ Điển,111,7799,6,5,8,0,False,Ae có công nhận đồ tuyển Anh rất cuốn không 😋 #aoretrocodien #aobongdaretro #aoretro #blokecore #aobongda ,16,1726795571,normal,"['aoretrocodien', 'aobongdaretro', 'aoretro', 'blokecore', 'aobongda']",2024-09-20,4.5,4,Mua Giá giá Giá mấy
7416595430307269894,ig: @mhreihan_,1012,35600,19,16,218,0,False,bloke core lagi👽 #tiktokfashion #outfit #fashionmen #mensstyle #outfitideas #outfitnspiration ,36,1726810702,normal,"['tiktokfashion', 'outfit', 'fashionmen', 'mensstyle', 'outfitideas', 'outfitnspiration']",2024-09-20,2.7777777777777777,18,"celana beli dimana kacauuuuuu‼️‼️‼️ kerenn blokecore style tipe rambutmu apa bang, gimana haircarenya keranjang kuningnya cuy kak sepatu adidas putih tanpa tali itu beli dimana spill celana bang spil carabiner sama rantainyaaa spil celana Worth it mang🔥 seleb gak bales keren sih ini emang 😁😁😁 Spil celanaa!!! 🔥🔥 blokecore bloke c"
7416646746039717125,Karbida_fc,14300,148200,158,113,455,0,False,Fokusnya di La Liga 😝 Gimana nih cul? #jersey #vintage #blokecore #laliga #barcelona #lamineyamal ,87,1726822651,normal,"['jersey', 'vintage', 'blokecore', 'laliga', 'barcelona', 'lamineyamal']",2024-09-20,2.9,20,"vamos barca ❤️💙 visca barca Visca barcaa💙❤️ ahh si admin fans real Madrid 😂 Visca Barca 💙❤️🙂 visca Barca 💙❤️ udah ketua kami malu🫸🫷 kalah menang tetap visca Barca ❤️💙 musuhnya Alex gak sih di serigala terakhir barca mode Spanyol pildun 2010 dan argentina pildun 2022, ngalah dulu di laga pertama 😌 Bang gua nyari tuh jersey kmna2 kaga nemu, seriusan bagi tempt dmna lo beli bang sebenarnya capekkk support barca, tpi gimana yaaa gak bisa pindah ke lain hatii 😭 tetep viisca barca💙♥️ Kalo bole tau lu fans apa bang🙏 beli dimana bg baju nya? wajar bg 10 lawan 11 lagian baru awal juga Sekali kali sapa gua bang,Sesama cules🗿😁🤝 aman ahh orang udh win 5-1😁 dia pikir Eric seperti Busquets amann tenang gpp amaaaaaaan kasih gua aja bang 🗿 bagus tuh Jersey nya 😂😂😂"
7416921886073949445,opsiformisqin,12,1098,0,0,0,0,False,Membalas @S U M M E R . Gimana ? Pilih jersey brazil second kw or indonesian jersey original wkwk tergantung selera ya guys 🖖🏻 #blokecore #jerseyindonesia #mills #brazil🇧🇷 ,15,1726886709,normal,"['blokecore', 'jerseyindonesia', 'mills', 'brazil🇧🇷']",2024-09-21,,0,
7416964261743693064,haruka chii 𖦹,209100,829100,1985,9683,45900,0,False,このコアに名前を付ける⋆⭒🎐˚｡⋆ #japan #japancore #aesthetic #ghibli #fyp #foryou #foryoupage #core ,9,1726896566,normal,"['japan', 'japancore', 'aesthetic', 'ghibli', 'fyp', 'foryou', 'foryoupage', 'core']",2024-09-21,3.923076923076923,39,이 코어좋아하시는분들 데스노트영화편 보세용 Kawaiicore 큐티코어아닌가ㅏ 하라주쿠? Viva el heisei retro 💖💖 이 노래 이름 뭐죠 ㅠ 사와코 목소리 말고 como se llama la canción?💕💓 puntito🥺 comentando para cambiar mi fpy 💕 como se llama este estilo? cómo se llama ese estilo? lleven me a japon😫 comentando para cambiar mi fy #20 Comentando para mejorar mi fyp💗 comentando para cambiar mi fyp 🌿 cambiando mí fyp 🫶🏻 Yo Organizando mi fyp!🌷💗 Cambiando mi fyp 🍥🍣 Summer Core cambiando mi para ti 🩷🌷 amén cambiando mi fyp 🍙🍥🍡 리포스트 보고가 ꪆ୧ ׅ ⬫ 𝒞ambiando my fyp que hermoso🥰 지브리 코어 juro Amo Comentando para mi fyp✨️🌸 🩷 tan yo Cambiando mi Fyp 🌷 comentando para mí fpy💗 necesito 심장이뛴다 comentario para cambiar mí fyp ☕🍃🍄🫧🐳 que lindo [flushed] amo.
7417086864475065605,William Clarence,959,25100,11,65,93,0,False,WKWKWKWK✌🏻 #footballtiktok #footballshirt #blokecore #fypシ #fypage ,7,1726925116,normal,"['footballtiktok', 'footballshirt', 'blokecore', 'fypシ', 'fypage']",2024-09-21,3.0,9,W closet🔥 Ampun 🙏 Surga Dunia kalo ilang satu kayanya ga ketauan nih🙏 Gurihhh sesama fans mu nihhh keren bng 😭😭😭😭😭 pernah pinjol buat beli jersey ga bang ahaha😂🙌🏼
7417356263069060370,Natthanon Aom,65,1682,9,4,10,0,False,Manchester is red ❤️🔥 #manchesterunited #jersey #blokecore #90s ,24,1726987835,normal,"['manchesterunited', 'jersey', 'blokecore', '90s']",2024-09-22,5.0,5,Vip🔥🔥 ไอดอลเลย👑 Follow me and let's talk about gifts and support😁 สวัสดีเพื่อนของฉันยินดีที่ได้รู้จักคุณ เพื่อไรรรนิ
