id,username,likes,views,comments,shares,collects,repost,isCommerce,description,duration,created_at,VideoQuality,hashtags,date,sentiment,comment_count,accumulated_text
7184783138940275973,_yasminedwards,732,89000,3,38,131,0,False,Styling a basketball jersey 🏀 #nba #basketball #basketballjersey #brooklynnets #kyrieirving #basketballoutfit #fashiontiktok #ootd #outfitinspo #styleinspo ,11,1672837688,normal,"['nba', 'basketball', 'basketballjersey', 'brooklynnets', 'kyrieirving', 'basketballoutfit', 'fashiontiktok', 'ootd', 'outfitinspo', 'styleinspo']",2023-01-04,3.6666666666666665,3,W player Pass What size is this jersey
7185249991064063238,𝓓𝓸𝓵𝓬𝓮 🍋,17700,282100,80,762,7453,0,False,Respondendo a @victorgabrielmart70 Achados versão masculina 💰🤎 #fy #oldmoney #oldmoneyaesthetic #oldmoneyoutfits #shein #sheinbr #achadosshein #moda #modamasculina #male #oldmoneyboys #vaiprofycaramba ,17,1672946386,normal,"['fy', 'oldmoney', 'oldmoneyaesthetic', 'oldmoneyoutfits', 'shein', 'sheinbr', 'achadosshein', 'moda', 'modamasculina', 'male', 'oldmoneyboys', 'vaiprofycaramba']",2023-01-05,2.65,20,old money curvy please parte 2?🥺 Id de la camiseta del último? porfa 👍🏻 Necesito los códigos ID de el segundooo el primero como lo encuentro ? código de todos plisss y los códigos? Ahora de Zara o H&M Qué tal uno para tallas un poco más grandes 😳 id de la camisa que tiene el coreano La sudadera del tercero con short verdes tienen los códigos de ambos?🥺 Nada a ve Eu amo essa loja Dazi na SHEIN só falta o dinheiro 😔 Qual o id da segunda roupa da introdução? posta com id🥲 Cant find them?? Faz mais e mais e mais 😳 Faz parte 2 ameiii demais
7185642408867155206,🐾The vrinch/fashion🐾,315,2729,0,2,30,0,False,#findyourstyle #blokecore #Blokecoreaesthetic ,10,1673037751,normal,"['findyourstyle', 'blokecore', 'blokecoreaesthetic']",2023-01-06,,0,
7185980455823346949,D a r i ◡̈,405,6755,1,12,111,0,False,Mi favorita #tendencias2023 #moda #blokettecore #style ,8,1673116458,normal,"['tendencias2023', 'moda', 'blokettecore', 'style']",2023-01-07,4.0,1,necesito saber cuál es tu pinterest pls
7186275249137224987,Kươn Ng 💁🏼‍♂️,2721,114600,59,33,168,0,False,Dạo này cứ mê áo đá bóng #fyp #outfit #style #fashion #blokecore #LearnOnTikTok #xuhuong ,49,1673185098,normal,"['fyp', 'outfit', 'style', 'fashion', 'blokecore', 'learnontiktok', 'xuhuong']",2023-01-08,3.735294117647059,34,"xin in4 cái tai nghe bro ơi giày là samba hả ông Jersey mua đâu v ạ Áo form đẹp thế a ơi visual có cái áo đẹp lắm quần j a zai anh cho em xin tip để mặc với áo bóng đá vs anh Mấy cái khuy cài mũ anh mua ở đâu vậy ạ em xin link quần ạ em cũng muốn mặc như v mà lúc mặc vào thì mẹ lại ko cho ko hiểu sao luôn⚰️ Xin link sling bag đi anh quần a mua đâu vậy a Tuyệt vời Anh thấy nên mua parachute pants của Chaos màu xanh hay đen ạ đầu :)) pass lun i pass tui ko a Toẹt @ĐạT🙉 @hoanggia mãi tóc của Neymar đẹp ngầu@Cung_cấp_công_việc288 mãi tóc của Neymar đẹp ngầu@nhẹ_nhàng_tại_nhà88 nghệ sĩ👍🏻⚽@Làm_việc_tại_nhà188 nghệ sĩ👍🏻⚽@tại_gia_đình_thuận_lợi88 Beyond cool, fantastic! 😍😍@Làm_việc_tại_nhà388 Beyond cool, fantastic! 😍😍@Làm_việc_tại_nhà188 Beyond cool, fantastic! 😍😍@viên_làm_thêm_nhà_làm88 @Endorphins mãi tóc của Neymar đẹp ngầu@làm_thêm_tại_nhà_thông_minh88 @Lê Hoàng Khang k tốn 2s fl đâu khang đẹp nha người ae 🔥, ra đường mà gặp là tới. bât tay liền 🙋🏻 đù mãi tóc của Neymar đẹp ngầu@gia_kiếm_tiền_gia_đình88 cr7 mà qua vn sẽ như thế nào nhỉ 😂@kiếm_tiền_linh_hoạt88 Bạn là nguồn cảm hứng cho tất cả@Cơ_hội_làm_thêm_tại88 Beyond cool, fantastic! 😍😍@Làm_thêm_tại_gia_đình88"
7186736959300291846,ANDY 🩸,62900,694500,223,1352,5430,0,False,La camiseta la conseguí en la tienda de ig (fixin_store) 📈❤️ #blokecore #blokecoreoutfit #bayernmunich ,25,1673292596,normal,"['blokecore', 'blokecoreoutfit', 'bayernmunich']",2023-01-09,2.289473684210526,38,cómo de llama esos pantalones? no conocia esa parte de tii mi estilo: y2k saludos bro NO. Cálidoso ⚽️🚬 De donde es la tupac?? Donde la camisa ? meo estilo mano marcelo salas hay algo q este muchacho no haga bien DONDE CONSEGUIS ESAS CAMISETAAAAASS sacando la magia 😳 esos trucos son falsos bro donde compraste esa polera? Mejor la del matador salas Grande el matador 🤘🤘🤘🤘un azul de corazón En que talla usas los jeans? que auriculares son?? literal yo cuando voy a ver a Colo Colo tienes zapas de fútbol?? nombre del pantalón? que talla de polera es? amo ese estilo solo que conseguír las camisas es complicado cómo puedo pedir ese tipo de pantalones? era algo obvio si es del Bayern iba a ser mágico y fachero Hay algo que este joven no haga bien ? como se llaman ese tipo de lentes????? cómo se llama la marca del pantalón?? por fa ?!? que corte son esos pantalones?? la de salas😮‍💨😮‍💨 Amigo las bapesta también hay que bajarles media talla como las Air force 1 Como se llaman los zapatos que llevabas al primcipio del video?? Donde consigo ese tipo de camisetas bro? Las Poleras y esas New Balance de abajo azules están 1000/10 bro😎😇 justo tengo puesto un pantalón dickies del mismo color hoy bro! Cn la del Matador salas se veia mjr
7187771543135571205,Classic Football Shirts,147700,1300000,511,2689,11100,0,False,Rate our fits 😎 #fitcheck #ootd #vintage #blokecore #footballshirts,31,1673533479,normal,"['fitcheck', 'ootd', 'vintage', 'blokecore', 'footballshirts']",2023-01-12,3.6666666666666665,3,Dream job😳 The oldskool chelsea badge is class and iam an arsenal fan haha That utd jacket look fireee
7187797084672675078,Rory,2626,32100,28,44,263,0,False,Combining styles #foryou #fashion #gorpcore #blokecore ,9,1673539426,normal,"['foryou', 'fashion', 'gorpcore', 'blokecore']",2023-01-12,3.0625,16,muestra como te queda Tiktok x tiktok core sling bag pls? Where you getting the cargos ? ID on the pants? Glasses? Harddd what shoes are those Thoughts on our new designs? 🤷‍♂️🤷‍♂️ Glasses? Shoes? @ben_c07 @Matt wth @Doran cheeky @justinvo1 styling taka jersey @jannis🦹🏽 des is voll geil mit den alten Trikots aber die Kopfhörer fühl ich nd Is
7190785764018392325,ANDY 🩸,216800,5300000,1875,3244,20300,0,False,Drip o Ñip ? 😏 #drip #dripstyle #outfitdrip #dripping ,24,1674235282,normal,"['drip', 'dripstyle', 'outfitdrip', 'dripping']",2023-01-20,2.138888888888889,36,"바지 정보 que drip, eso es ñip ñip ñip hermanooo donde conseguiste la camisa? no tienes el código bro? el drip no es los pantalones más Pegados yo no sé de outfit, pero ese si es dryp juro que podría ser el mejor que eh visto que se infome un poco no? Ñip no puedes tener drip con esos zapatos no es drip según lo que vi eso es ñipppp mezcla de drip y Y2K que pantalones son? Donde consiguen esos tipos de pants yo desde hace mucho quiero uno pero no se donde los venden 😅? Y uno para no delicuentes eres el unico que sabes vestir bien el drip. Bro una pregunta cuanto mides de altura no es drip es ñip Drip no era una expresión? 지리노 no es drip es una mezcla de y2k con drip XD Info of pants pants name pls😭😭 Ñip Ñip Ñip UUUF 😮‍💨 no es drip pero esta durisimo es el de brasil😻 ñipp xD ñip Bonita polera ñip ñip"
7191117648241937691,nào đông khách sẽ đổi tên,1520,57600,27,15,46,0,False,Trả lời @Trí Phannn Tập 12: Blokecore outfit with Soccer Jersey / 500 cành mua đồ Balenxida-a-di-daphat #mrblokecore #blokecore #blokecoreoutfit #TetDongMoiVuiLays #reviewlamdep ,54,1674312555,normal,"['mrblokecore', 'blokecore', 'blokecoreoutfit', 'TetDongMoiVuiLays', 'reviewlamdep']",2023-01-21,3.0,13,"cho e xin link mua quần 3 sọc Cho em xin link mua áo ạ trời ơi áo đỏ anh mặc i hệt áo em luôn 😁 Cái parachute pants anh mặc đầu clip em lại thấy đẹp vs hợp hơn 😂 bộ đầu vd là mẫu j v ạ em nghĩ mang đôi superstar, stan smith, forum đồ thì sẽ tăng độ đẹp lên hơn á 🤣 Có link mua áo ko anh đẹp á a đôi yeezy phá vl A thử phối áo đá bóng + sơ mi cà vạt giống Ruud Gullit đi ạ phèn Juve đi Mua áo ntn vậy"
7191527310367968517,stuccigus,114800,1300000,1325,5642,10700,0,False,bloke core baby #fyp #fypp #fyppppppppppppppppppppppp #foryou #viral #blokecore ,12,1674407937,normal,"['fyp', 'fypp', 'fyppppppppppppppppppppppp', 'foryou', 'viral', 'blokecore']",2023-01-22,3.6956521739130435,23,"Héctor bellakin Héctor Maletín oye hermano, es mejor crear uno su propio estilo :3 Héctor Medellín Hector tallarin? 😳 Hector Bellerin vibes! bellerin from wish Hector ballerina Бельерин? Ayo belerin rocked up the barca shirt 😍😍 Hector bellerin? Where did you get the Barca shirt? 🔥 what’s your tattoo aftercare bro?? they look so good hector membatin Béc be rin Where can I get those vintage jerseys? Especially barca? bro’s made in china bellerin mano tens jogo hj pa BELLERIN FEAT CHAPLIN Hector bellerin from alixpress Héctor modillín @evan hexagon bellerbin"
7191580503550528810,thefashionaries,147300,603300,695,1539,5089,0,False,I’m just a girl that lives on pinterest #blokettecore #blokette #coquette #pinterestoutfit ,5,1674420330,normal,"['blokettecore', 'blokette', 'coquette', 'pinterestoutfit']",2023-01-22,3.1,20,The fact I knew it was blokette core without even looking at the tags 💀 I’m in too deep i get it but like i don’t think it looks good but i also a tiny bit do but also no but i get it but also i hate that kind of boots no babe i still dont get it in a couple of years youre going to look back and realize how cool u were for dressing like this!! Oh! blokette…. this is so important omg i get it ❤️❤️ love pinterest! hate this outfit! ❤️ hmmm…it still doesn’t this is an unprecedented level of slay i can relate! i get it but i don’t but i do?? you're so pretty I get it but at the same time I don’t but I love it in a weird way this is me when i wear tie dye and plaid together. no ❤️ it shocks me that people DONT get it … i'm sorry but in a couple of years your going to be so embarrassed that u dressed like that amen Slay
7193730462626434330,nào đông khách sẽ đổi tên,5103,168200,68,70,337,0,False,Trả lời @𝑜̂𝑛𝑔 𝐴𝑛ℎ 🧒🏻 Tập 13: Blokecore outfit with Juventus home shirt 2002/03 / mới chơi blokecore thì mặc gì?! #mrblokecore #blokecore #blokecoreoutfit #reviewlamdep ,32,1674920901,normal,"['mrblokecore', 'blokecore', 'blokecoreoutfit', 'reviewlamdep']",2023-01-28,1.5,8,thấy cái áo nhớ anh phan cái ghế a cố tình để đấy à anh phối thử với barca centennial 1899-1999 đi anh Em mựn cái áo đi ăn cứiiiii 😁 xin in4 quần anh ơi bạn chỉ mình cách mua áo này được không? mancity đi bro Ac Milan 2007 đi anh
7194855616093949190,Meffy Madrid,9909,124800,43,319,1163,0,False,no me puede gustar SJDJSJ🤪🤪 #greenscreen #moda2023 #moda2023tendencias #modayestilo #modaytendencias #modaentiktok #modatiktok #fashiontiktok #blokettecore #blokette #blokettefashion #fashiontrends #fashiontrends2023 #2023 #modaparatodas #modafeminina #modamasculina #deporte #deportesentiktok #deportestiktok #futboltok #fashiontok #outfitinspo #coquette #coquetteaesthetic #aestheticoutfits #ideasdeoutfits #outfitsparasalir ,53,1675182867,normal,"['greenscreen', 'moda2023', 'moda2023tendencias', 'modayestilo', 'modaytendencias', 'modaentiktok', 'modatiktok', 'fashiontiktok', 'blokettecore', 'blokette', 'blokettefashion', 'fashiontrends', 'fashiontrends2023', '2023', 'modaparatodas', 'modafeminina', 'modamasculina', 'deporte', 'deportesentiktok', 'deportestiktok', 'futboltok', 'fashiontok', 'outfitinspo', 'coquette', 'coquetteaesthetic', 'aestheticoutfits', 'ideasdeoutfits', 'outfitsparasalir']",2023-01-31,3.55,20,"waooo primera Primeraa 💗 Hola para ir al gym Yo la amo<33 muy nuevos pantalones 😂😂 es mí onda de años ..me alegra ahora este en tendencia 😁 yo cuando en la mañana voy a la uni y en la noche tengo partido: los corsé están muy lindos, lo demás meh es que lo peor son las zapatillas i cant A mi si me gusto y si lo usaria Estoy obsesionada con la idea de comprarme una polera de Colo-colo desde que vi a Princesa Alba cantando en el monumental el año pasado 😳🤍🖤 Animate a crear un look así y hacemos fotos 😎 seria épico 📸✨ cuales son esas adidas negras con blanco? lo usaría pero quizás no tan corte deportivo Yo soy mas estilo y2k pero probé este estilo y me encanta 💗💗y se ve super bonito lo recomiendo 😼😼 yo lo vi y lo AME lo ando usando a veces, me recuerda a los rusos jajaj Es sport elegant pero más extravagante🫠 Entonses cuando voy a ver furbol estoy usando una moda? elegante sport jaja"
7196321373617376518,✭ Stwar✭,1980,37800,9,14,280,0,False,Streetwear>>#blokecore #streetwear #moda #style #fyp #aesthetic ,9,1675524142,normal,"['blokecore', 'streetwear', 'moda', 'style', 'fyp', 'aesthetic']",2023-02-04,3.6666666666666665,9,Limonada En Lata 👉👈 streetwear puro y2k 🤝🗿 outfit blokecore de shein 🥺 yoo mas streetwear monocromatico 😁🤙 soft boy es gooooooddd @ale.f1yc5 cyber y2k streetwear
7196519882601745710,Destiny Sharee | FASHION,226,84300,3,6,61,0,False,Day 8 of styling a jersey for Super Bowl Sunday 😋 #baggyoutfit #superbowl #30daysofoutfits #grwm #outfitinspiration #howtostyleajersey #footballoutfit #footballgameoutfit #footballgameootd #oversizedoutfit ,9,1675570367,normal,"['baggyoutfit', 'superbowl', '30daysofoutfits', 'grwm', 'outfitinspiration', 'howtostyleajersey', 'footballoutfit', 'footballgameoutfit', 'footballgameootd', 'oversizedoutfit']",2023-02-05,3.6666666666666665,3,🥰🥰🥰 He’ll no fellow me friends🥺🥺🥺
7196927951961607450,Táo rì viu nghiêm túc,8973,109700,68,140,920,0,False,Thời trang bóng đá | #outfit #fyp #xh #fashion ,19,1675665377,normal,"['outfit', 'fyp', 'xh', 'fashion']",2023-02-06,3.230769230769231,39,"phải mặc form từ những năm 90 đầu 2000 mới đẹp kiểu nó như oversize ý T phối cũng y vậy, đi cf vs tụi bạn mà tụi nó hỏi chuẩn bị mày đi đá banh à :))) mua áo bóng đá đá kiểu polo mang bao đẹp mua áo style này ở đâu nhỉ Ae biết chỗ nào bán ko Ông đầu tên j z VN áo đá banh quần thể dục dép lào 😂:)) mấy áo này ở đâu nhỉ Bellerin phong cách đúng chất áo bóng đá quần tây,style quen thuộc của lớp tớ🤣 Mua áo retro nhé các bn đừng mua áo Thái 😂 Bellerin đỉnh vãi mn cho link mua mấy mẫu áo này khong ạ Hector Bellerin 🥰🥰 xịn áo thứ 3 mua ở đâu v ae trước t mặc thử style này 1 lần và bị chê tới chê lui xong k mặc nữa luôn=))) I like it! Chất quá ạ goodjob! Có vẻ đẹp :)) mê sao trông nên mình mặc nó sao sao ấy😂 quần ông s6 đẹp quớ Phối kiểu này khó với lại kén người lắm, mấy ông xem xong video lại mặc theo ra đường thì oidoioi đấy 😂 hector ok nhất Mê Làm quần áo webcore đi tụi nó chê tui không có T-shirt kiểu khác à kk tui thích rồi đó 😂 đẹp thích hay không thì bạn cũng thử phong cách này 1 lần nhé ♥️ @Lil Wiked @Milo2kkkkk @Playboicuto @Râu.D @xinloi @vqt2811 @thai3oo42oo5 @vqt2811"
7198529554707729691,Wafiqiquwan,51700,624700,289,652,2790,0,False,Blokecore style 🕺🏻,15,1676038274,normal,[],2023-02-10,2.25,20,"🫶🏻 masalahnya muka abg pun vintage saya nak tau gak bang mana dapat banyak banyak baju ni semua lawa mat review sikit kaset player kat belakang tu bang Lebih ke mulyadi sih abang ni notice aku tak buat operation slipped disc 😂👊🏻 mana dapat baju jersey Malaysia yg lama tu ? saya ade DUNHILL 🇲🇾 merah jer tapi x ingat tahun bila punya bro stuck at the 80's jersi selangor vintage ada tak kalau ada nak beli Nanti 23 mac pergi SSI pakai centu bang 👍🏻 pinggang size ape bro ? bang nanti amik lesen kalau dh ada lesen suka hati ko lah bang tuck in ke x dapat mne jersey tuuu...smart siott mengimbau zaman lalu😂 abang ni anak ruudgulit ke? pkai la outfit apa pun abg ni tetap nampak vintage 🤭🤭 abg pkai cenggini tiba2 sy teringat plak player dulu2 Mokhtar Dahari mcm style ayah aku, sampai skarang dia punya style mcm nie 🤣🤣 Style wooo"
7201349517604588827,Mr. Blokecore,59300,680000,135,1198,5742,0,False,Blokecore outfit with… #mrblokecore #learnontiktok #blokecore #vintage #xuhuong ,16,1676694849,normal,"['mrblokecore', 'LearnOnTikTok', 'blokecore', 'vintage', 'xuhuong']",2023-02-18,3.6,20,"thích style này mà điều kiện ko cho phép😅 atletico Madrid please eso ya la hicimos hace mucho 😏 Es el oufit final en ""amar te duele "" ohhhh yo tengo esa camiseta del ajax, gracias por el outfit para la combi 🥹❤️🤍🇳🇱 muchos nos vestimos así en los 90s en la primaria 🤣🤣 Héctor Cepillín can you style the world cup Argentina shirt e xin chỗ bán mấy cái áo kiểu vậy ạ cho e xin info dây chuyền với ạ quần jeans đen thì hợp hơn Đức đi anh xin link áo anh ơi🥺 Ây da, tui có nguyên 1 bộ giống ô này hihi, khác cái quần tommy của mình màu đen fade=)) Where I can buy this shirt? Chelsea 2022/2023 link áo đâu ? Đẹp v Сагат аты кандай? em xin chỗ mua cái kính"
7202340185789467947,thefashionaries,395100,2600000,1799,2476,13300,0,False,"sporty in the front, girly in the back #blokettecore #blokette #pinterestoutfit #pinterestgirl ",5,1676925513,normal,"['blokettecore', 'blokette', 'pinterestoutfit', 'pinterestgirl']",2023-02-20,3.6842105263157894,38,ya no no… No! aveces menos es mas no bc ur about to get a blockette for this outfit 😭😭😭😭 Pinterest is an echo chamber of people just making uglier and uglier outfits and the convincing eacjpther it’s cute just because you can doesn't mean you should i love blokette it usually looks weird but weird pinterest styles have a place in my heart interesting Bye we really are all little wheels in the capitalist machine I love blokette sm ahhh can someone plz explain blockette to me I actually think the outfit is cute. I think one bigger bow would be cute but do whatever makes you happy WHAT🔥🔥🔥🔥 blokette is one of the cutest aesthetics EVERRR this is an outfit you can only get away with in new york i get it blokette is nice but the amt of bows this is so sandy liang bella hadid adidas samba blokette core make the bows red sandy liang girly 🎀🫶🏼 In love with your hair I get this outfit so much I can’t tell if I love or hate it Chronically online aesthetic HOW DO U DO THE HAIR I CANT FIGURE IT OUTTTT i am constantly scrolling through pinterest and i truly do not get this but whatever makes u happy I like it idk Okay that purseee!!! Whaaat? Where? How? 💘💘💘 NOOO I USED TO HAVE THAT PURSE actually love this UR SO CUTE less bows and it’s pretty good idk why people are hating i LOVE blokette 4 the win icon Blokette and the simone rocha hair loveee
7203350960729591083,blokettes™,673,38000,8,55,298,0,False,international baby tees out now ! 👀👀💓 #blokettecore #y2kfashion #babytee #pinterestoutfit #fyp #blokecore #mexico ,8,1677160855,normal,"['blokettecore', 'y2kfashion', 'babytee', 'pinterestoutfit', 'fyp', 'blokecore', 'mexico']",2023-02-23,2.8,5,are you going to make a premium mexico shirt soon🥹? Can you make one with the flag colors ? more sizes plsss🥲🖤 bffr Restock plssssss
7203605962421259547,nào đông khách sẽ đổi tên,3200,96800,84,64,132,0,False,Trả lời @Nhật Ký của Maguire Tập 17: Blokecore outfit with Barca & MU 1998 / mối lương duyên tại cúp Châu Âu. #blokecore #mrblokecore #blokecoreoutfit #learnontiktok #xuhuong ,56,1677220218,normal,"['blokecore', 'mrblokecore', 'blokecoreoutfit', 'learnontiktok', 'xuhuong']",2023-02-24,2.358974358974359,39,"áo MU đẹp quá a Ad ơi cho mình hỏi có biết chỗ nào bán áo auth của Ronaldo không ạ . muuuu barca A mua áo đá banh vintage ở đâu ạ Áo giggs có bán kh ạ in4 giày Adidas a ơi quần tommy jean mua ở đâu v anh Xin link đồng hồ vs vòng ông ơi Cũng đc đấy mang dép đc ko kkk quần tommy đó tên gì vậy ạ Mình xin chỗ bán short với ạ áo argentina 2022 3 sao mua đâu v anh .-. áo tên mssi .-. Chỉ chổ mua nón đi ông 🥺🥺 Mua ở đâu a ơiiii Hỏi thật mong ông chỉ cho ae mua mấy áo như này ở đâu nón anh mua đâu v Nón mua ở đâu v ạ anh chỉ chỗ mua nón đi ạ 🥺 Mua áo đâu v bạn Alo anh ơi em có con gerrard của liver anh xem giúp em được hong ạ đồ đẹp quá ông bạn ở đâu thế Cho em xin tên shop bán cái quần đó với anh ơi 😅 Áo a mặc size gì thế A cao, nặng và mặc size bn thế ạ Nón mua Âu anh Áo có cổ phối quần nào đẹp bạn ơi Quá đẹp Mua áo ở đâu v a Áo đá banh đó mua ở đâu vậy oing 2 đẹp hơn nhiều Ae mua mấy áo mu cổ như này ở đâu z a Mua áo ở đau b Xin chổ bán nón vintage nhé Mua nón đâu v ạ A này có sở thấy mặc đồ đá banh giống mình nè, mình mặc từ hồi cấp 1 tới giờ đã 22t. Anh ơi tìm em liver được không a Ac milan anh ơi mua đâu v ạ"
7203730995638455579,Mr. Blokecore,96900,933600,392,3304,9879,0,False,Trả lời @Người ngoài hành lang Blokecore outfit with… #mrblokecore #blokecoreoutfit #blokecore #vintage #classic #tiktokfashion #ootd #xuhuong ,17,1677249328,normal,"['mrblokecore', 'blokecoreoutfit', 'blokecore', 'vintage', 'classic', 'TikTokFashion', 'OOTD', 'xuhuong']",2023-02-24,3.7,20,"vamo argentina lokooo🇦🇷🇦🇷🇦🇷 naaaaa💤💤💤💤 yo tengo esa camiseta :D donde compraate la remeraaaaaaa nuestros viejos eran aesthetics sin darse cuenta 옷 어디서삼 y a donde tan elegante argentina aesthetic Es bonita, pero la vintage más bonita de Argentina es la de 1997 de Adidas. mi país bzrp 🙀🙀🙀 Bzrp argentina core yo pepe argento con la 2006 de argentina el davo que flow de seguro vas a una boda mi aburlo"
7206399651308653830,Innofoot,67500,556000,303,4056,10100,0,False,Football shirt drip >>> #CapCut #innofoot #blokecore #blokecoreoutfit #blokecoresummer #footballshirt #footballdrip #blokecorefashion #clothing #footballshirts #fy #viral ,8,1677870672,normal,"['capcut', 'innofoot', 'blokecore', 'blokecoreoutfit', 'blokecoresummer', 'footballshirt', 'footballdrip', 'blokecorefashion', 'clothing', 'footballshirts', 'fy', 'viral']",2023-03-03,3.3333333333333335,12,"@richard.zimm I need a ac Milan jersey or a Brazil one it only works if you watch football It just works better with retro kits Ac Milan has the cleanest shirts I’VE BEEN SEARCHING polska , gdzie kupić pro tip: only wear it if you actually like the team or player only if u play and watch football then its valid i’m sayingggg Blokecore Are they authentic Its called blokecore"
7206618284064574746,Donejoy,362,7299,6,5,25,0,False,Mùa hè mặc kiểu này là hết bài luôn anh em #outfitinspiration #outfitinspo2022 #blokecore #outfiideas #whatiwore #fashiontrends ,16,1677921581,normal,"['outfitinspiration', 'outfitinspo2022', 'blokecore', 'outfiideas', 'whatiwore', 'fashiontrends']",2023-03-04,3.6666666666666665,3,@Quý ông củ nghệ thử phong cách này xem sao. Đỡ phải may đo 🤣 xin mấy sốp bán áo kiểu v với aem Quần jean mua đâu vậy ông
7207037480955055386,ihutmanalu46,526,146800,31,118,155,0,False,Sepatu Non Halal #newbalance  #newbalance574legacy  #nb  #nb574  #blokecore  #arsenal ,20,1678019180,normal,"['newbalance', 'newbalance574legacy', 'nb', 'nb574', 'blokecore', 'arsenal']",2023-03-05,2.411764705882353,17,"bang mau nanya sizing NB yg bener gimana ya? di web 28 cm 44, di zalora 28cm 43 saya jg fans arsenal bang, semoga musim ini menangg harga berapa bang bang mau tanya ini detail nya nb apa ya? itu semua seri 574 non halal kah bang apa tergantung seri? saya beli yang classic. tapi trift Silver birch with sea salt x kalau yg ini halal ga? Harga brapa bang? bg mau nanya bedanya sama nb 574 classic sama yg legacy apa? true to sz? gua dapet warna hijau keren abis 💚 bang kalo NB 574 Beach Cruiser , warna grey green, Made in Vietnam, beli thrift, kira kira Pigskin apa engga ya bang?? bang, semua seri 574 legacy itu non halal? non halal rupanya hade mana baru beli lagi🤣 kecehhh😍 @anwarivan_ kakkoii😁 maksud nya non halal apa bang? NB 574 yg bukan dari kulit bab* ada ga bg"
7207612108647812378,Táo rì viu nghiêm túc,986,16800,5,13,67,0,False,Thời trang bóng đá P2 #outfits #blokecore #xuhuong #fashion #foryou ,15,1678152984,normal,"['outfits', 'blokecore', 'xuhuong', 'fashion', 'foryou']",2023-03-07,3.5,4,này ở tây thôi ở vn bị gọi bán vé số ngay 😅😅😅 🍃 Cẩn thận
7208037125533617434,ole 💋,161,4828,0,1,22,0,False,Trying the Blokette core #blokettefashion #blokettecore #blokette  #dressupwithme #ootdfashion #clothescontent #ootd  #fashioninspo ,16,1678251935,normal,"['blokettefashion', 'blokettecore', 'blokette', 'dressupwithme', 'ootdfashion', 'clothescontent', 'ootd', 'fashioninspo']",2023-03-08,,0,
